summary_id,tier,is_valid,validation_confidence,grade_score,coherence_score,factuality_score,issues_count,processing_time_ms,justification,original_grade,production_ready,level3_priority_final,source_id_x,tier_rank,source_id_m1,source_id_m2,source_id_filled,source_id_y,title,url,article_id_x,text,article_id_y,strategy,summary_before,n1_coherence,n1_factuality,l3_mode,mode_reason,has_text,enough_length,lang,lang_mismatch,topic_overlap_before_text
28_confidence_weighted,CRITICAL,False,0.1,0.2,0.3621281896925904,0.6679369211196899,5,0.0,Grade D non production ready - traitement ML critique,D,False,1.0,d92c051212ee70d3,0,,,d92c051212ee70d3,d92c051212ee70d3,TOP 11 AI MARKETING TOOLS YOU SHOULD USE (Updated 2022),https://techncruncher.blogspot.com/2022/07/top-10-ai-marketing-tools-you-should-use.html,28,"The marketing industry is turning to artificial intelligence (AI) as a way to save time and execute smarter, more personalized campaigns. 61% of marketers say AI software is the most important aspect of their data strategy.

If you’re late to the AI party, don’t worry. It’s easier than you think to start leveraging artificial intelligence tools in your marketing strategy. Here are 11 AI marketing tools every marketer should start using today.





Jasper is a content writing and content generation tool that uses artificial intelligence to identify the best words and sentences for your writing style and medium in the most efficient, quick, and accessible way. Key Features It's trusted by 50,000+ marketers for creating engaging marketing campaigns, ad copy, blog posts, and articles within minutes which would traditionally take hours or days. Special Features:

Blog posts have been optimized for search engines and rank high on Google and other search engines. This is a huge plus for online businesses that want to generate traffic to their website through content marketing.

99.9% Original Content and guarantees that all content it generates will be original, so businesses can focus on their online reputation rather than worrying about penalties from Google for duplicate content.

Long-Form Article Writing – Jasper.ai is also useful for long-form writing, allowing users to create articles of up to 10,000 words without any difficulty. This is ideal for businesses that want to produce in-depth content that will capture their audience’s attention. Wait! I've got a pretty sweet deal for you. Sign up through the link below, and you'll get (10k Free Credits)









2. Personalize

Personalize is an AI-powered technology that helps you identify and produce highly targeted sales and marketing campaigns by tracking the products and services your contacts are most interested in at any given time. The platform uses an algorithm to identify each contact’s top three interests, which are updated in real-time based on recent site activity.

Key Features

Identifies top three interests based on metrics like time on page, recency, and frequency of each contact

Works with every ESP and CRM

Easy to get up and running in days

Enterprise-grade technology at a low cost for SMBs

3. Seventh Sense

Seventh Sense provides behavioral analytics that helps you win attention in your customers’ overcrowded email inboxes. Choosing the best day and time to send an email is always a gamble. And while some days of the week generally get higher open rates than others, you’ll never be able to nail down a time that’s best for every customer. Seventh Sense eases your stress of having to figure out the perfect send-time and day for your email campaigns. The AI-based platform figures out the best timing and email frequency for each contact based on when they’re opening emails. The tool is primarily geared toward HubSpot and Marketo customers

Key Features

AI determines the best send-time and email frequency for each contact

Connects with HubSpot and Marketo

4. Phrasee

Phrasee uses artificial intelligence to help you write more effective subject lines. With its AI-based Natural Language Generation system, Phrasee uses data-driven insights to generate millions of natural-sounding copy variants that match your brand voice. The model is end-to-end, meaning when you feed the results back to Phrasee, the prediction model rebuilds so it can continuously learn from your audience.

Key Features

Instantly generates millions of human-sounding, brand-compliant copy variants

Creates tailored language models for every customer

Learns what your audience responds to and rebuilds the prediction model every time

5. Hubspot Seo

HubSpot Search Engine Optimization (SEO) is an integral tool for the Human Content team. It uses machine learning to determine how search engines understand and categorize your content. HubSpot SEO helps you improve your search engine rankings and outrank your competitors. Search engines reward websites that organize their content around core subjects, or topic clusters. HubSpot SEO helps you discover and rank for the topics that matter to your business and customers.

Key Features

Helps you discover and rank topics that people are searching for

Provides suggestions for your topic clusters and related subjects

Integrates with all other HubSpot content tools to help you create a well-rounded content strategy

6. Evolve AI

When you’re limited to testing two variables against each other at a time, it can take months to get the results you’re looking for. Evolv AI lets you test all your ideas at once. It uses advanced algorithms to identify the top-performing concepts, combine them with each other, and repeat the process to achieve the best site experience.

Key Features

Figures out which content provides the best performance

Lets you test multiple ideas in a single experiment instead of having to perform many individual tests over a long period

Lets you try all your ideas across multiple pages for full-funnel optimization

Offers visual and code editors

7. Acrolinx

Acrolinx is a content alignment platform that helps brands scale and improves the quality of their content. It’s geared toward enterprises – its major customers include big brands like Google, Adobe, and Amazon - to help them scale their writing efforts. Instead of spending time chasing down and fixing typos in multiple places throughout an article or blog post, you can use Acrolinx to do it all right there in one place. You start by setting your preferences for style, grammar, tone of voice, and company-specific word usage. Then, Acrolinx checks and scores your existing content to find what’s working and suggest areas for improvement. The platform provides real-time guidance and suggestions to make writing better and strengthen weak pages.

Key features

Reviews and scores existing content to ensure it meets your brand guidelines

Finds opportunities to improve your content and use automation to shorten your editorial process.

Integrates with more than 50 tools and platforms, including Google Docs, Microsoft Word, WordPress, and most web browsers.

8. MarketMuse

MarketMuse uses an algorithm to help marketers build content strategies. The tool shows you where to target keywords to rank in specific topic categories, and recommends keywords you should go after if you want to own particular topics. It also identifies gaps and opportunities for new content and prioritizes them by their probable impact on your rankings. The algorithm compares your content with thousands of articles related to the same topic to uncover what’s missing from your site.

Key features:

The built-in editor shows how in-depth your topic is covered and what needs improvement

Finds gaps and opportunities for new content creation, prioritized by their probable impact and your chance of ranking

9. Copilot

Copilot is a suite of tools that help eCommerce businesses maintain real-time communication with customers around the clock at every stage of the funnel. Promote products, recover shopping carts and send updates or reminders directly through Messenger.

Key features:

Integrate Facebook Messenger directly with your website, including chat history and recent interactions for a fluid customer service experience

Run drip messenger campaigns to keep customers engaged with your brand

Send abandoned carts, out-of-stock, restock, preorder, order status, and shipment notifications to contacts

Send branded images, promotional content, or coupon codes to those who opt in

Collect post-purchase feedback, reviews, and customer insight

Demonstrate social proof on your website with a widget, or push automatic Facebook posts sharing recent purchases

Display a promotional banner on your website to capture contacts instantly

10. Yotpo

Yotpo’s deep learning technology evaluates your customers’ product reviews to help you make better business decisions. It identifies key topics that customers mention related to your products—and their feelings toward them. The AI engine extracts relevant reviews from past buyers and presents them in smart displays to convert new shoppers. Yotpo also saves you time moderating reviews. The AI-powered moderation tool automatically assigns a score to each review and flags reviews with negative sentiment so you can focus on quality control instead of manually reviewing every post.

Key features:

Makes it easy for shoppers to filter reviews and find the exact information they’re looking for

Analyzes customer feedback and sentiments to help you improve your products

Integrates with most leading eCommerce platforms, including BigCommerce, Magento, and Shopify.

11. Albert AI

Albert is a self-learning software that automates the creation of marketing campaigns for your brand. It analyzes vast amounts of data to run optimized campaigns autonomously, allowing you to feed in your own creative content and target markets, and then use data from its database to determine key characteristics of a serious buyer. Albert identifies potential customers that match those traits, and runs trial campaigns on a small group of customers—with results refined by Albert himself—before launching it on a larger scale.

Albert plugs into your existing marketing technology stack, so you still have access to your accounts, ads, search, social media, and more. Albert maps tracking and attribution to your source of truth so you can determine which channels are driving your business.

Key features:

Breaks down large amounts of data to help you customize campaigns

Plugs into your marketing technology stack and can be used across diverse media outlets, including email, content, paid media, and mobile





Final Saying

There are many tools and companies out there that offer AI tools, but this is a small list of resources that we have found to be helpful. If you have any other suggestions, feel free to share them in the comments below this article. As marketing evolves at such a rapid pace, new marketing strategies will be invented that we haven't even dreamed of yet. But for now, this list should give you a good starting point on your way to implementing AI into your marketing mix.

Note: This article contains affiliate links, meaning we make a small commission if you buy any premium plan from our link.",28,confidence_weighted,"L'ex-président syrien Bachar al-Assad a été renversé en décembre 2013 et n'est plus président, a-t-il déclaré. L'ex-président syrien Bachar al-Assad a été renversé en décembre 2013 et n'est plus président, a-t-il déclaré. L'ex-président syrien Bachar al-Assad a été renversé en décembre 2013 et n'est plus président, a-t-il déclaré. L'ex-président syrien Bachar al-Assad a été renversé en décembre 2013 et n'est plus président, a-t-il déclaré. L'ex-président syrien Bachar al-Assad a été renversé en décembre 2013 et n'est plus président, a-t-il déclaré. Le mandat d'arrêt visant le président syrien déchu Bachar al-Assad pour des attaques chimiques en 2013 qui ont fait plus de mille morts. La Cour de cassation a annulé, vendredi 25 juillet, le mandat. Le procureur général près de la Cour avait émis un mandat pour complicité de crimes contre l'humanité. Le mandat d'arrêt visant le président syrien déchu Bachar al-Assad pour des attaques chimiques en 2013 qui ont fait plus de mille morts. La Cour de cassation a annulé, vendredi 25 juillet, le mandat. Le procureur général près de la Cour avait émis un mandat pour complicité de crimes contre l'humanité. Le mandat d'arrêt visant le président syrien déchu Bachar al-Assad pour des attaques chimiques en 2013 qui ont fait plus de mille morts. La Cour de cassation a annulé, vendredi 25 juillet, le mandat. Le procureur général près de la Cour avait émis un mandat pour complicité de crimes contre l'humanité. Le mandat d'arrêt visant le président syrien déchu Bachar al-Assad pour des attaques chimiques en 2013 qui ont fait plus de mille morts. La Cour de cassation a annulé, vendredi 25 juillet, le mandat. Le procureur général près de la Cour avait émis un mandat pour complicité de crimes contre l'humanité. Le mandat d'arrêt visant le président syrien déchu Bachar al-Assad pour des attaques chimiques en 2013 qui ont fait plus de mille morts. La Cour de cassation a annulé, vendredi 25 juillet, le mandat. Le procureur général près de la Cour avait émis un mandat pour complicité de crimes contre l'humanité.",0.3621,0.6679,re_summarize,cw_critical_with_text,True,True,en,False,0.0015552099533437
31_confidence_weighted,CRITICAL,False,0.4157899438564217,0.4,0.4406990216621234,0.9514681100845336,5,0.0,Grade C non production ready - traitement ML critique,C,False,1.0,cc214d510c169588,0,,,cc214d510c169588,cc214d510c169588,ProWritingAid VS Grammarly: Which Grammar Checker is Better in (2022) ?,https://techncruncher.blogspot.com/2022/03/prowritingaid-vs-grammarly-which.html,31,"ProWritingAid VS Grammarly: Which Grammar Checker is Better in (2022) ?

When it comes to English grammar, there are two Big Players that everyone knows of: the Grammarly and ProWritingAid. but you are wondering which one to choose so here we write a detail article which will help you to choose the best one for you so Let's start

What is Grammarly?

Grammarly is a tool that checks for grammatical errors, spelling, and punctuation.it gives you comprehensive feedback on your writing. You can use this tool to proofread and edit articles, blog posts, emails, etc.

Grammarly also detects all types of mistakes, including sentence structure issues and misused words. It also gives you suggestions on style changes, punctuation, spelling, and grammar all are in real-time. The free version covers the basics like identifying grammar and spelling mistakes

whereas the Premium version offers a lot more functionality, it detects plagiarism in your content, suggests word choice, or adds fluency to it.





Features of Grammarly

Spelling and Word Suggestion: Grammarly detects basic to advance grammatical errors and also help you why this is an error and suggest to you how you can improve it

Create a Personal Dictionary: The Grammarly app allows you to add words to your personal dictionary so that the same mistake isn't highlighted every time you run Grammarly.

Different English Style : Check to spell for American, British, Canadian, and Australian English.

Plagiarism: This feature helps you detect if a text has been plagiarized by comparing it with over eight billion web pages.

Wordiness: This tool will help you check your writing for long and hard-to-read sentences. It also shows you how to shorten sentences so that they are more concise.

Passive Voice: The program also notifies users when passive voice is used too frequently in a document.

Punctuations: This feature flags all incorrect and missing punctuation.

Repetition: The tool provides recommendations for replacing the repeated word.

Proposition: Grammarly identifies misplaced and confused prepositions.



Plugins: It offers Microsoft Word, Microsoft Outlook, and Google Chrome plugins.





What is ProWritingAid?

ProWritingAid is a style and grammar checker for content creators and writers. It helps to optimize word choice, punctuation errors, and common grammar mistakes, providing detailed reports to help you improve your writing.

ProWritingAid can be used as an add-on to WordPress, Gmail, and Google Docs. The software also offers helpful articles, videos, quizzes, and explanations to help improve your writing.

Features of ProWriting Aid

Here are some key features of ProWriting Aid:

Grammar checker and spell checker: This tool helps you to find all grammatical and spelling errors.

Find repeated words: The tool also allows you to search for repeated words and phrases in your content.

Context-sensitive style suggestions: You can find the exact style of writing you intend and suggest if it flows well in your writing.

Check the readability of your content: Pro Writing Aid helps you identify the strengths and weaknesses of your article by pointing out difficult sentences and paragraphs.

Sentence Length: It also indicates the length of your sentences.

Check Grammatical error: It also checks your work for any grammatical errors or typos, as well.

Overused words: As a writer, you might find yourself using the same word repeatedly. ProWritingAid's overused words checker helps you avoid this lazy writing mistake.

Consistency: Check your work for inconsistent usage of open and closed quotation marks.

Echoes: Check your writing for uniformly repetitive words and phrases.

Difference between Grammarly and Pro-Writing Aid

Grammarly and ProWritingAid are well-known grammar-checking software. However, if you're like most people who can't decide which to use, here are some different points that may be helpful in your decision.

Grammarly vs ProWritingAid

Grammarly is a writing enhancement tool that offers suggestions for grammar, vocabulary, and syntax whereas ProWritingAid offers world-class grammar and style checking, as well as advanced reports to help you strengthen your writing.

Grammarly provides Android and IOS apps whereas ProWritingAid doesn't have a mobile or IOS app.

Grammarly offers important suggestions about mistakes you've made whereas ProWritingAid shows more suggestions than Grammarly but all recommendations are not accurate

Grammarly has a more friendly UI/UX whereas the ProWritingAid interface is not friendly as Grammarly.

Grammarly is an accurate grammar checker for non-fiction writing whereas ProWritingAid is an accurate grammar checker for fiction writers.

Grammarly finds grammar and punctuation mistakes, whereas ProWritingAid identifies run-on sentences and fragments.

Grammarly provides 24/7 support via submitting a ticket and sending emails. ProWritingAid’s support team is available via email, though the response time is approximately 48 hours.

Grammarly offers many features in its free plan, whereas ProWritingAid offers some basic features in the free plan.

Grammarly does not offer much feedback on big picture writing; ProWritingAid offers complete feedback on big picture writing.

Grammarly is a better option for accuracy, whereas ProWritingAid is better for handling fragmented sentences and dialogue. It can be quite useful for fiction writers.

ProWritingAid VS Grammarly: Pricing Difference

ProWritingAid comes with three pricing structures. The full-year cost of ProWritingAid is $79, while its lifetime plans cost $339. You also can opt for a monthly plan of $20.

Grammarly offers a Premium subscription for $30/month for a monthly plan $20/month for quarterly and $12/month for an annual subscription.

The Business plan costs $12.50 per month for each member of your company.

ProWritingAid vs Grammarly – Pros and Cons

Grammarly Pros

It allows you to fix common mistakes like grammar and spelling.

Offers most features in the free plan

Allows you to edit a document without affecting the formatting.

Active and passive voice checker

Personal dictionary

Plagiarism checker (paid version)

Proofread your writing and correct all punctuation, grammar, and spelling errors.

Allows you to make changes to a document without altering its formatting.

Helps users improve vocabulary

User-friendly interface

Browser extensions and MS word add-ons

Available on all major devices and platforms

Grammarly will also offer suggestions to improve your style.

Enhance the readability of your sentence

Free mobile apps

Offers free version

Grammarly Cons

Supports only English

Customer support only via email

Limits to 150,000 words

Subscription plans can be a bit pricey

Plagiarism checker is only available in a premium plan

Doesn’t offer a free trial

No refund policy

The free version is ideal for basic spelling and grammatical mistakes, but it does not correct advanced writing issues.

Some features are not available for Mac.

ProwritingAid Pros

It offers more than 20 different reports to help you improve your writing.

Less expensive than other grammar checkers.

This tool helps you strengthen your writing style as it offers big-picture feedback.

ProWritingAid has a life plan with no further payments required.

Compatible with Google Docs!

Prowritingaid works on both Windows and Mac.

They offer more integrations than most tools.

ProWritingAid Cons

Editing can be a little more time-consuming when you add larger passages of text.

ProWritingAid currently offers no mobile app for Android or iOS devices.

Plagiarism checker is only available in premium plans.

All recommendations are not accurate

Summarizing the Ginger VS Grammarly: My Recommendation

As both writing assistants are great in their own way, you need to choose the one that suits you best.

For example, go for Grammarly if you are a non-fiction writer

Go for ProWritingAid if you are a fiction writer.

ProWritingAid is better at catching errors found in long-form content. However, Grammarly is more suited to short blog posts and other similar tasks.

ProWritingAid helps you clean up your writing by checking for style, structure, and content while Grammarly focuses on grammar and punctuation.

Grammarly has a more friendly UI/UX whereas; ProWritingAid offers complete feedback on big picture writing.

Both ProWritingAid and Grammarly are awesome writing tools, without a doubt. but as per my experience, Grammarly is a winner here because Grammarly helps you to review and edit your content. Grammarly highlights all the mistakes in your writing within seconds of copying and pasting the content into Grammarly’s editor or using the software’s native feature in other text editors.

Not only does it identify tiny grammatical and spelling errors, it tells you when you overlook punctuations where they are needed. And, beyond its plagiarism-checking capabilities, Grammarly helps you proofread your content. Even better, the software offers a free plan that gives you access to some of its features.",31,confidence_weighted,"Ce jeudi 24 juillet, le CISPE, qui rassemble des fournisseurs de cloud européens, a déposé un recours devant le tribunal de l’Union européen. Ce jeudi 24 juillet, le CISPE, qui rassemble des fournisseurs de cloud européens, a déposé un recours devant le tribunal de l’Union européen. Ce jeudi 24 juillet, le CISPE, qui rassemble des fournisseurs de cloud européens, a déposé un recours devant le tribunal de l’Union européen. Ce jeudi 24 juillet, le CISPE, qui rassemble des fournisseurs de cloud européens, a déposé un recours devant le tribunal de l’Union européen. Ce jeudi 24 juillet, le CISPE, qui rassemble des fournisseurs de cloud européens, a déposé un recours devant le tribunal de l’Union européen. L'association « Cloud Infrastructure Service Providers in Europe » (CISPE) a déposé un recours devant le tribunal de l'Union européenne. Il vise à faire annuler la décision de la Commission européenne autorisant le rachat de VMWare par Broadcom. En juillet 2023, Bruxelles validait la vente de VMware, une société qui commercialise des logiciels de virtualisation. L'association « Cloud Infrastructure Service Providers in Europe » (CISPE) a déposé un recours devant le tribunal de l'Union européenne. Il vise à faire annuler la décision de la Commission européenne autorisant le rachat de VMWare par Broadcom. En juillet 2023, Bruxelles validait la vente de VMware, une société qui commercialise des logiciels de virtualisation. L'association « Cloud Infrastructure Service Providers in Europe » (CISPE) a déposé un recours devant le tribunal de l'Union européenne. Il vise à faire annuler la décision de la Commission européenne autorisant le rachat de VMWare par Broadcom. En juillet 2023, Bruxelles validait la vente de VMware, une société qui commercialise des logiciels de virtualisation. L'association « Cloud Infrastructure Service Providers in Europe » (CISPE) a déposé un recours devant le tribunal de l'Union européenne. Il vise à faire annuler la décision de la Commission européenne autorisant le rachat de VMWare par Broadcom. En juillet 2023, Bruxelles validait la vente de VMware, une société qui commercialise des logiciels de virtualisation. L'association « Cloud Infrastructure Service Providers in Europe » (CISPE) a déposé un recours devant le tribunal de l'Union européenne. Il vise à faire annuler la décision de la Commission européenne autorisant le rachat de VMWare par Broadcom. En juillet 2023, Bruxelles validait la vente de VMware, une société qui commercialise des logiciels de virtualisation.",0.4407,0.9515,re_summarize,cw_critical_with_text,True,True,en,False,0.0
