summary_id,tier,is_valid,validation_confidence,grade_score,coherence_score,factuality_score,issues_count,processing_time_ms,justification,original_grade,production_ready,level3_priority_final,source_id_x,tier_rank,source_id_m1,source_id_m2,source_id_filled,source_id_y,title,url,article_id_x,text,article_id_y,strategy,summary_before,n1_coherence,n1_factuality,l3_mode,mode_reason,has_text,enough_length,lang,lang_mismatch,topic_overlap_before_text
118_confidence_weighted,CRITICAL,False,0.3897219284862261,0.4,0.4917889707267245,0.8794248104095459,6,0.0,Grade C non production ready - traitement ML critique,C,False,1.0,8f6ca28dd2ee370b,0,,,8f6ca28dd2ee370b,8f6ca28dd2ee370b,"« Contre l’hégémonie culturelle des droites dures, menons une bataille politique et budgétaire »",https://www.nouvelobs.com/politique/20250723.OBS106145/contre-l-hegemonie-culturelle-des-droites-dures-menons-une-bataille-politique-et-budgetaire.html,118,"Lire plus tard Google Actualités Partager Masquer ce message Vous souhaitez partager cet article ? Facebook Bluesky E-mail Copier le lien Saisir ici votre nom Adresse email des ou du destinataire Votre message S’abonner

Le 24 juin 2025, au Casino de Paris s’est tenu un « Sommet des Libertés » qui a suscité un vif intérêt bien au-delà des cercles qui y étaient conviés. C’est que sur scène, Jordan Bardella, Eric Ciotti, Sarah Knafo et Marion Maréchal Le Pen donnaient à ce raout des allures de meeting politique. Si le Casino de Paris est la propriété de Vincent Bolloré, l’homme derrière l’organisation de ce « sommet » est Pierre-Edouard Stérin, déjà sponsor depuis 2021 des touts aussi mal nommées « Nuits du Bien commun ». Via son fonds « d’intelligence politique » Périclès, doté de 150 millions d’euros, le milliardaire exilé fiscal en Belgique s’emploie à financer les candidats d’extrême droite. Son projet politique tient dans l’acronyme « Périclès » : Patriotes, Enracinés, Résistants, Identitaires, Chrétiens, Libéraux, Européens, Souverainistes.

A lire aussi

Au « Sommet de la Liberté », cependant, il est moins question de projet que d’« ennemis intérieurs » de la France : l’Etat, sa « guillotine fiscale » et ses agences, les syndicats, « ceux qui nous détestent » et qu’il faudrait soumettre à la « remigration », en un mot tous ces « wokistes » qui auraient remporté la bataille pour l’hégémonie culturelle. La faute à cette « gauche » qui aurait, selon eux, noyauté la société française par le biais des partis politiques de gauche comme de droite, les « élites intellectuelles », les institutions culturelles, l’école publique, l’université ou encore les réseaux associatifs. Et puisqu’elle est partout, il n’y a plus de sens à parler de « culture de gauche » ou d’« Etat de gauche » : c’est la culture tout court qu’il faut combattre, ainsi que l’Etat qui en serait l’agent de propagande.

Publicité

Première tactique : pour contrôler les idées, il faut prendre le contrôle de leurs supports de diffusion. Le rachat des groupes médias et d’édition en est une étape clef, suivie, en général, d’un réalignement idéologique plus ou moins brutal, plus ou moins uniforme.

Deuxième stratégie : s’approprier le langage et les symboles appartenant à notre héritage commun. « Bien commun, liberté d’expression, vérité », mais aussi de Gaulle, Dreyfus, Jaurès, que l’extrême droite n’hésite pas à convoquer dans les discours avec une perverse jubilation : peu leur importe que chacune de ces grandes personnalités de l’histoire eût combattu ses ancêtres jusqu’à leur dernier souffle. Le concept même d’hégémonie culturelle, développé par l’intellectuel marxiste italien Antonio Gramsci dans les années 1920, est depuis les années 1980 revendiqué par la droite et l’extrême droite : Marion Maréchal, qui cite abondamment Gramsci dans ses discours, n’est que l’une des dernières d’une longue série. Comme les nazis, d’après la thèse classique de Johann Chapoutot, avaient détourné l’héritage de l’Antiquité aux fins de propagande, comme ils ont par la suite aliéné l’épithète « socialiste » pour mieux en déposséder la gauche, l’extrême droite s’en va piller les principes républicains pour mieux les vider de leur substance.

Mais c’est la troisième arme qui devrait nous inquiéter le plus – l’arme budgétaire. Si, au « Sommet des Libertés », il est autant question de « couper les vivres » à l’Etat « obèse », si les « Nuits du Bien commun » lancées sous l’égide de Stérin servent d’abord à financer des associations ultra-conservatrices proposant un « contre-modèle », il n’y a à cela nul hasard. Bien sûr, les finances publiques sont plus rassembleuses et moins scandaleuses que l’invocation de l’héritage de Maurras. Mais l’enjeu est ailleurs : 150 millions d’euros d’économies en 2025, 200 millions en 2026 : au regard des 44 milliards d’économies proposées par le gouvernement Bayrou, ce sont littéralement des kopeks. L’arme budgétaire a en fait une visée politique : acculer la culture publique pour l’étouffer peu à peu. Cela fait cinquante ans que les libéraux utilisent cette arme pour tuer les services publics qui, pour des raisons politiques ou idéologiques, leur sont devenus indésirables.

Observons leur rhétorique. Puisque la culture porte une vision du monde engagée – forcément de gauche –, pourquoi serait-ce au contribuable de payer ? Les régions aux mains de la droite et de l’extrême droite n’ont pas manqué d’y aller de main forte, fustigeant au passage l’« idéologie militante » des acteurs de la culture. Plus adroits, cependant, que les diatribes de Christelle Morançais (présidente Horizons du Conseil régional des Pays de la Loire qui a réduit le budget alloué à la culture de 73 %) contre « les associations très politisées, qui vivent d’argent public », le discours de son conseiller Alexandre Thébault (LR) : réfutant toute décision idéologique, il puise dans le lexique de la responsabilité économique d’un bon père de famille.

Publicité

Femmes engagées en politique et actrices de la culture, nous ne savons que trop bien combien la guerre culturelle menée par Poutine (en Russie) et Milei (en Argentine) dans les pays où nous sommes respectivement nées a été fondatrice pour le démantèlement de leurs structures démocratiques. Pour démanteler les politiques culturelles, l’extrême droite n’a pas besoin d’être aux commandes ; le gouvernement dit « de centre » s’en charge très bien. Faire passer des choix politiques pour des techniques de bonne gestion ; recouvrir l’idéologie du vernis de l’efficacité économique ; imposer les idées conservatrices sous couvert de « neutralité » : c’est là que pourrait se nouer la possible – et délétère – alliance entre les droites et le centre. Nous ne pouvons nous résoudre à voir la France glisser à son tour sur cette pente et appelons tous ceux qui sont en responsabilité à renouer avec un esprit de combat.

Le nerf de cette guerre, c’est la résistance culturelle tout autant que budgétaire. L’exception culturelle que le monde entier nous envie doit autant à Mitterrand et à Lang qu’à de Gaulle et à Malraux. Lorsque le second, auquel le premier avait confié les Affaires culturelles, inaugurait le ministère du même nom, il entendait protéger l’art et la pensée de la pure logique marchande.

Ce combat n’est pas qu’une affaire de gauche, mais un défi pour la droite républicaine et le centre. Si nous voulons préserver notre démocratie, la culture doit redevenir une cause commune, et pas des moindres. Avant même de penser aux échéances électorales, les politiques culturelles doivent être remises immédiatement au centre des négociations budgétaires. Si aucun accord n’est trouvé, voilà une raison supplémentaire pour censurer un gouvernement qui aurait reculé face à la guerre culturelle désormais menée ouvertement par les droites conservatrices.

BIOS EXPRESS

Diana Filippova est romancière et essayiste, ancienne conseillère d’Anne Hidalgo. Paula Forteza est ancienne députée et fondatrice d’Artivistas, galerie d’art engagée d’Amérique latine",118,confidence_weighted,"À la fin des années 1990, plusieurs équipes ont utilisé des supernovaesupernovae de type SNSN Ia pour étudier l'expansion du cosmoscosmos observable. À la fin des années 1990, plusieurs équipes ont utilisé des supernovaesupernovae de type SNSN Ia pour étudier l'expansion du cosmoscosmos observable. À la fin des années 1990, plusieurs équipes ont utilisé des supernovaesupernovae de type SNSN Ia pour étudier l'expansion du cosmoscosmos observable. À la fin des années 1990, plusieurs équipes ont utilisé des supernovaesupernovae de type SNSN Ia pour étudier l'expansion du cosmoscosmos observable. À la fin des années 1990, plusieurs équipes ont utilisé des supernovaesupernovae de type SNSN Ia pour étudier l'expansion du cosmoscosmos observable. Les supernovae SNSN Ia ont été étudiées à la fin des années 1990. Les chercheurs décrocheront le prix Nobel de physique le siècle suivant pour avoir mis en évidence une accélération récente de l'expansion du cosmoscosmos observable. Les supernovae SNSN Ia ont été étudiées à la fin des années 1990. Les chercheurs décrocheront le prix Nobel de physique le siècle suivant pour avoir mis en évidence une accélération récente de l'expansion du cosmoscosmos observable. Les supernovae SNSN Ia ont été étudiées à la fin des années 1990. Les chercheurs décrocheront le prix Nobel de physique le siècle suivant pour avoir mis en évidence une accélération récente de l'expansion du cosmoscosmos observable. Les supernovae SNSN Ia ont été étudiées à la fin des années 1990. Les chercheurs décrocheront le prix Nobel de physique le siècle suivant pour avoir mis en évidence une accélération récente de l'expansion du cosmoscosmos observable. Les supernovae SNSN Ia ont été étudiées à la fin des années 1990. Les chercheurs décrocheront le prix Nobel de physique le siècle suivant pour avoir mis en évidence une accélération récente de l'expansion du cosmoscosmos observable.",0.4918,0.8794,re_summarize,cw_critical_with_text,True,True,fr,False,0.0056818181818181
131_confidence_weighted,CRITICAL,False,0.3728246117731293,0.4,0.4355597688953796,0.9168157577514648,6,0.0,Grade C non production ready - traitement ML critique,C,False,1.0,574e875ed09a7233,0,,,574e875ed09a7233,574e875ed09a7233,« My Father’s Son » : un ambitieux drame mémoriel et dystopique,https://www.nouvelobs.com/cinema/20250722.OBS106132/my-father-s-son-un-ambitieux-drame-memoriel-et-dystopique.html,131,"« My Father’s Son », avec Weichen Luo. COPYRIGHT NEW STORY

Lire plus tard Google Actualités Partager Masquer ce message Vous souhaitez partager cet article ? Facebook Bluesky E-mail Copier le lien Saisir ici votre nom Adresse email des ou du destinataire Votre message S’abonner

Pour aller plus loin

Dans un futur proche, un ingénieur modélise un logiciel d’entraînement à la boxe en s’appuyant sur les traits de son père mort des années plus tôt. Cet ambitieux drame mémoriel et dystopique se perd parfois dans ses méandres mais cisèle de brusques et beaux moments d’émotion.",131,confidence_weighted,"KAY NIETFELD/ Partager Vous souhaitez Facebook Bluesky E-mail Copier le lien Saisir ici votre nom Adresse email des ou du destinataire Votre message S’abonner Le jeudi 6 juin, un gros mois avant qu’Emmanuel Macron n’annonce que la France allait reconnaître un Etat de Palestine en septembre, le ministre des Affaires étrangères, Jean-Nol Barrot ménageait déjà le suspense sur la question de la reconnaissance d’un Etat palestinien. KAY NIETFELD/ Partager Vous souhaitez Facebook Bluesky E-mail Copier le lien Saisir ici votre nom Adresse email des ou du destinataire Votre message S’abonner Le jeudi 6 juin, un gros mois avant qu’Emmanuel Macron n’annonce que la France allait reconnaître un Etat de Palestine en septembre, le ministre des Affaires étrangères, Jean-Nol Barrot ménageait déjà le suspense sur la question de la reconnaissance d’un Etat palestinien. KAY NIETFELD/ Partager Vous souhaitez Facebook Bluesky E-mail Copier le lien Saisir ici votre nom Adresse email des ou du destinataire Votre message S’abonner Le jeudi 6 juin, un gros mois avant qu’Emmanuel Macron n’annonce que la France allait reconnaître un Etat de Palestine en septembre, le ministre des Affaires étrangères, Jean-Nol Barrot ménageait déjà le suspense sur la question de la reconnaissance d’un Etat palestinien. KAY NIETFELD/ Partager Vous souhaitez Facebook Bluesky E-mail Copier le lien Saisir ici votre nom Adresse email des ou du destinataire Votre message S’abonner Le jeudi 6 juin, un gros mois avant qu’Emmanuel Macron n’annonce que la France allait reconnaître un Etat de Palestine en septembre, le ministre des Affaires étrangères, Jean-Nol Barrot ménageait déjà le suspense sur la question de la reconnaissance d’un Etat palestinien. KAY NIETFELD/ Partager Vous souhaitez Facebook Bluesky E-mail Copier le lien Saisir ici votre nom Adresse email des ou du destinataire Votre message S’abonner Le jeudi 6 juin, un gros mois avant qu’Emmanuel Macron n’annonce que la France allait reconnaître un Etat de Palestine en septembre, le ministre des Affaires étrangères, Jean-Nol Barrot ménageait déjà le suspense sur la question de la reconnaissance d’un Etat palestinien. La France est « déterminée » à reconnaître un État palestinien, mais elle ne le fera pas seul. 148 des 193 États membres de l'ONU ont déjà reconnu un territoire de Palestine. Berlin « continue de considérer la reconnaissance d'un Etat de Palästina comme une dernière étoile », déclare le porte-parole du gouvernement. La France est « déterminée » à reconnaître un État palestinien, mais elle ne le fera pas seul. 148 des 193 États membres de l'ONU ont déjà reconnu un territoire de Palestine. Berlin « continue de considérer la reconnaissance d'un Etat de Palästina comme une dernière étoile », déclare le porte-parole du gouvernement. La France est « déterminée » à reconnaître un État palestinien, mais elle ne le fera pas seul. 148 des 193 États membres de l'ONU ont déjà reconnu un territoire de Palestine. Berlin « continue de considérer la reconnaissance d'un Etat de Palästina comme une dernière étoile », déclare le porte-parole du gouvernement. La France est « déterminée » à reconnaître un État palestinien, mais elle ne le fera pas seul. 148 des 193 États membres de l'ONU ont déjà reconnu un territoire de Palestine. Berlin « continue de considérer la reconnaissance d'un Etat de Palästina comme une dernière étoile », déclare le porte-parole du gouvernement. La France est « déterminée » à reconnaître un État palestinien, mais elle ne le fera pas seul. 148 des 193 États membres de l'ONU ont déjà reconnu un territoire de Palestine. Berlin « continue de considérer la reconnaissance d'un Etat de Palästina comme une dernière étoile », déclare le porte-parole du gouvernement.",0.4356,0.9168,re_summarize,cw_critical_with_text,True,True,en,True,0.1565217391304348
12_confidence_weighted,CRITICAL,False,0.166808764112662,0.2,0.3978944309009528,0.8595384955406189,5,0.0,Grade D non production ready - traitement ML critique,D,False,1.0,461e0a8c5eb56c46,0,,,461e0a8c5eb56c46,461e0a8c5eb56c46,Woman in viral Coldplay concert clip resigns from executive role,https://www.bbc.com/news/articles/cp3l3ldd0j1o,12,"Female exec captured in viral Coldplay concert clip resigns

1 day ago Share Save Christal Hayes BBC News, Los Angeles Share Save

Awkward moment for couple on screen at Coldplay gig

A US tech company's chief people officer who was apparently caught on a big screen at a Coldplay concert embracing the company's CEO has resigned. Kristin Cabot is no longer working for Astronomer, the firm told the BBC in a statement. Her departure follows that of Andy Byron, the company's former CEO, who left last week after the firm announced he would be placed on leave and investigated. It shows a man and a woman, who were identified by US media as the co-workers, embracing on a jumbo screen at the arena before they abruptly ducked and hid.",12,confidence_weighted,"Emmanuel Macron et le président syrien Ahmed al-Charaa lors d'une conférence de presse à l'Élysée, à Paris, le . Emmanuel Macron et le président syrien Ahmed al-Charaa lors d'une conférence de presse à l'Élysée, à Paris, le . Emmanuel Macron et le président syrien Ahmed al-Charaa lors d'une conférence de presse à l'Élysée, à Paris, le . Emmanuel Macron et le président syrien Ahmed al-Charaa lors d'une conférence de presse à l'Élysée, à Paris, le . Emmanuel Macron et le président syrien Ahmed al-Charaa lors d'une conférence de presse à l'Élysée, à Paris, le . Le ministre français des Affaires étrangères, Jean-Nol Barrot, a convenu que Paris accueillerait «dans les plus brefs délais un nouveau cycle de consultations entre le gouvernement syrien et les forces démocratiques kurdes soutenues par Washington». Les Kurdes ont critiqué la déclaration constitutionnelle accordant les pleins pouvoirs à l'ancien chef jihadiste. Le ministre français des Affaires étrangères, Jean-Nol Barrot, a convenu que Paris accueillerait «dans les plus brefs délais un nouveau cycle de consultations entre le gouvernement syrien et les forces démocratiques kurdes soutenues par Washington». Les Kurdes ont critiqué la déclaration constitutionnelle accordant les pleins pouvoirs à l'ancien chef jihadiste. Le ministre français des Affaires étrangères, Jean-Nol Barrot, a convenu que Paris accueillerait «dans les plus brefs délais un nouveau cycle de consultations entre le gouvernement syrien et les forces démocratiques kurdes soutenues par Washington». Les Kurdes ont critiqué la déclaration constitutionnelle accordant les pleins pouvoirs à l'ancien chef jihadiste. Le ministre français des Affaires étrangères, Jean-Nol Barrot, a convenu que Paris accueillerait «dans les plus brefs délais un nouveau cycle de consultations entre le gouvernement syrien et les forces démocratiques kurdes soutenues par Washington». Les Kurdes ont critiqué la déclaration constitutionnelle accordant les pleins pouvoirs à l'ancien chef jihadiste. Le ministre français des Affaires étrangères, Jean-Nol Barrot, a convenu que Paris accueillerait «dans les plus brefs délais un nouveau cycle de consultations entre le gouvernement syrien et les forces démocratiques kurdes soutenues par Washington». Les Kurdes ont critiqué la déclaration constitutionnelle accordant les pleins pouvoirs à l'ancien chef jihadiste.",0.3979,0.8595,re_summarize,cw_critical_with_text,True,True,en,False,0.0
