summary_id,tier,is_valid,validation_confidence,grade_score,coherence_score,factuality_score,issues_count,processing_time_ms,justification,original_grade,production_ready,level3_priority_final,source_id_x,tier_rank,source_id_m1,source_id_m2,source_id_filled,source_id_y,title,url,article_id_x,text,article_id_y,strategy,summary_before,n1_coherence,n1_factuality,l3_mode,mode_reason,has_text,enough_length,lang,lang_mismatch,topic_overlap_before_text
50_confidence_weighted,CRITICAL,False,0.3903676436400199,0.4,0.4601107021283675,0.8343743085861206,5,0.0,Grade C non production ready - traitement ML critique,C,False,1.0,a38511d05577177c,0,,,a38511d05577177c,a38511d05577177c,Reconnaissance de l’Etat de Palestine : quels pays pourraient suivre la France ?,https://www.nouvelobs.com/monde/20250725.OBS106214/reconnaissance-de-l-etat-de-palestine-quels-pays-pourraient-suivre-la-france.html,50,"Emmanuel Macron, Friedrich Merz et Keir Starmer se rencontrent à La Haye à l’hôtel de la délégation en marge du sommet de l’Otan, le 24 juin 2025. KAY NIETFELD/DPA/SIPA

Lire plus tard Google Actualités Partager Masquer ce message Vous souhaitez partager cet article ? Facebook Bluesky E-mail Copier le lien Saisir ici votre nom Adresse email des ou du destinataire Votre message S’abonner

Le jeudi 6 juin, un gros mois avant qu’Emmanuel Macron n’annonce que la France allait reconnaître un Etat de Palestine en septembre, le ministre des Affaires étrangères, Jean-Noël Barrot ménageait déjà le suspense. La France est « déterminée » à reconnaître un Etat palestinien, mais ne le fera pas seule, synthétisait l’ancien secrétaire général du MoDem.

A lire aussi

Faut-il alors voir la déclaration du président de la République comme la première vague d’une série de reconnaissance à venir ? A ce jour, 148 des 193 Etats membres de l’ONU ont déjà reconnu un Etat palestinien mais aucun membre du G7.

Publicité

Si l’Irlande, l’Espagne, la Norvège et la Slovénie ont acté la reconnaissance de l’Etat de Palestine en 2024, les Européens restent divisés sur cette question. Pour l’heure, la France a donc agi seule.

Un non pour Berlin

L’Allemagne a répété ce vendredi « ne pas envisager de reconnaître un Etat palestinien à court terme ». Berlin « continue de considérer la reconnaissance d’un Etat palestinien comme l’une des dernières étapes vers la solution à deux Etats », a précisé dans un communiqué le porte-parole du gouvernement allemand, Stefan Kornelius, rappelant que la sécurité d’Israël « revêt une importance primordiale » pour l’Allemagne.

A lire aussi

En raison de son passé nazi, l’Allemagne est, avec les Etats-Unis, l’un des plus fervents soutiens d’Israël, et a même fait de la sécurité de ce pays « une raison d’Etat » depuis 2008.

Vers une reconnaissance des Britanniques ?

Principal allié d’Emmanuel Macron sur le sujet, le Premier ministre britannique Keir Starmer a, lui, insisté début juillet sur l’importance de l’obtention d’un cessez-le-feu pour amorcer un « processus » de reconnaissance. Un tiers des députés britanniques ont d’ailleurs appelé leur Premier ministre à reconnaître l’Etat de Palestine ce vendredi.

Publicité

L’initiative a été lancée par la députée travailliste Sarah Champion, présidente de la commission parlementaire chargée du Développement international, et a recueilli les signatures d’élus issus notamment du Labour, du parti conservateur, des libéraux-démocrates, des Verts, du parti indépendantiste écossais SNP, mais aussi d’indépendants.

Ces derniers mois, les discussions diplomatiques se sont d’ailleurs intensifiées, notamment avec le Canada et le Royaume-Uni, deux autres membres du G7. La France coprésidera en septembre avec l’Arabie saoudite une conférence internationale au niveau des chefs d’Etat et de gouvernement pour essayer de relancer la solution dite « à deux Etats », palestinien et israélien.

A lire aussi

Paris « mobilisera tous ceux de ses partenaires internationaux qui souhaitent y prendre part », a écrit ce vendredi Emmanuel Macron dans une lettre au président de l’Autorité palestinienne Mahmoud Abbas. Une réunion au niveau ministériel sur le sujet se tient lundi et mardi à New York.

Les dirigeants britanniques Keir Starmer, français Emmanuel Macron et allemand Friedrich Merz ont tenu ce vendredi un « entretien d’urgence », prévu avant l’annonce de la France, pour voir comment « arrêter les massacres et fournir à la population la nourriture dont elle a désespérément besoin ». « La catastrophe humanitaire à laquelle nous assistons à Gaza doit cesser immédiatement », ont exhorté Paris, Londres et Berlin, dans un communiqué commun.

Publicité

« Nous appelons le gouvernement israélien à lever immédiatement les restrictions sur l’acheminement de l’aide et à permettre de toute urgence à l’ONU et aux ONG humanitaires de mener à bien leur travail afin de lutter contre la famine », ont-ils ajouté, rappelant à Israël qu’il « doit respecter ses obligations en vertu du droit international humanitaire ».",50,confidence_weighted,"Pedro Pascal est Reed Richards, alias Mr. Fantastique, dans le reboot des aventures des « 4 Fantastiques : Premiers Pas », en salle le . Pedro Pascal est Reed Richards, alias Mr. Fantastique, dans le reboot des aventures des « 4 Fantastiques : Premiers Pas », en salle le . Pedro Pascal est Reed Richards, alias Mr. Fantastique, dans le reboot des aventures des « 4 Fantastiques : Premiers Pas », en salle le . Pedro Pascal est Reed Richards, alias Mr. Fantastique, dans le reboot des aventures des « 4 Fantastiques : Premiers Pas », en salle le . Pedro Pascal est Reed Richards, alias Mr. Fantastique, dans le reboot des aventures des « 4 Fantastiques : Premiers Pas », en salle le . Les « 4 fantastiques » vivent en famille super-héroque dans un fantasme rétrofuturiste. La mécanique Marvel reprend ses droits... Avec « Premiers Pas », Matt Shakman, artisan télévisuel rompu à l'exercice du pastiche (« WandaVision », « Game of Thrones »). Les « 4 fantastiques » vivent en famille super-héroque dans un fantasme rétrofuturiste. La mécanique Marvel reprend ses droits... Avec « Premiers Pas », Matt Shakman, artisan télévisuel rompu à l'exercice du pastiche (« WandaVision », « Game of Thrones »). Les « 4 fantastiques » vivent en famille super-héroque dans un fantasme rétrofuturiste. La mécanique Marvel reprend ses droits... Avec « Premiers Pas », Matt Shakman, artisan télévisuel rompu à l'exercice du pastiche (« WandaVision », « Game of Thrones »). Les « 4 fantastiques » vivent en famille super-héroque dans un fantasme rétrofuturiste. La mécanique Marvel reprend ses droits... Avec « Premiers Pas », Matt Shakman, artisan télévisuel rompu à l'exercice du pastiche (« WandaVision », « Game of Thrones »). Les « 4 fantastiques » vivent en famille super-héroque dans un fantasme rétrofuturiste. La mécanique Marvel reprend ses droits... Avec « Premiers Pas », Matt Shakman, artisan télévisuel rompu à l'exercice du pastiche (« WandaVision », « Game of Thrones »).",0.4601,0.8344,re_summarize,cw_critical_with_text,True,True,fr,False,0.0060975609756097
56_confidence_weighted,CRITICAL,False,0.13837710888655,0.2,0.3510541063839399,0.8428335189819336,5,0.0,Grade D non production ready - traitement ML critique,D,False,1.0,113da3cfde6533dd,0,,,113da3cfde6533dd,113da3cfde6533dd,Le mandat d’arrêt français visant l’ex-président syrien Bachar al-Assad annulé par la Cour de Cassation,https://www.nouvelobs.com/justice/20250725.OBS106208/le-mandat-d-arret-francais-visant-l-ex-president-syrien-bachar-al-assad-annule-par-la-cour-de-cassation.html,56,"Par Le Nouvel Obs avec AFP

Publié le 25 juillet 2025 à 15h46 , mis à jour le 25 juillet 2025 à 16h18 Lecture : 1 min.

Un portrait défiguré de l’ex président syrien Bachar al-Assad dans un centre de sécurité gouvernemental saccagé, à Damas, le 8 décembre 2024, le jour du renversement de son régime. RAMI AL SAYED/AFP

Lire plus tard Google Actualités Partager Masquer ce message Vous souhaitez partager cet article ? Facebook Bluesky E-mail Copier le lien Saisir ici votre nom Adresse email des ou du destinataire Votre message S’abonner

L’immunité personnelle dont bénéficient les chefs d’Etat en exercice ne peut souffrir d’aucune exception a jugé ce vendredi 25 juillet la Cour de Cassation, annulant ainsi le mandat d’arrêt pour complicité de crimes contre l’humanité et de crimes de guerre émis par des juges d’instruction parisiens contre l’ex-président syrien Bachar al-Assad concernant des attaques chimiques en 2013 ayant fait plus de mille morts.

A lire aussi

Le mandat d’arrêt avait été délivré en novembre 2023 alors que Bachar al-Assad « était encore chef d’Etat en exercice » et n’était donc pas « régulier », a déclaré le président de la Cour de Cassation, Christophe Soulard, lors d’une audience publique diffusée de manière inédite en direct sur internet. La plus haute juridiction de l’ordre judiciaire français « annule » donc le mandat d’arrêt.

Publicité

« Cependant », depuis que Bachar al-Assad a été renversé en décembre 2024 et n’est plus président, « de nouveaux mandats d’arrêt ont pu ou pourront être délivrés à son encontre pour des faits susceptibles de constituer des crimes de guerre et des crimes contre l’humanité », a développé Christophe Soulard. L’information judiciaire ouverte à son encontre peut donc se poursuivre, a-t-il ajouté.

Cette décision était très attendue en France comme à l’étranger, notamment par les organisations de défense des droits de l’homme engagées dans la lutte contre l’impunité des chefs d’Etat soupçonnés de crimes internationaux sur leur population.

A lire aussi

Le mandat d’arrêt émis par les juges d’instruction parisiens en novembre 2023 avait été contesté par le Parquet national antiterroriste, au nom de l’immunité absolue dont jouissent les chefs d’Etat en exercice devant les tribunaux de pays étrangers. Mais la cour d’appel avait validé ce mandat en juin 2024, estimant que ces crimes « ne peuvent être considérés comme faisant partie des fonctions officielles d’un chef de l’Etat ». Puis, après un appel du parquet général, c’était à la Cour de Cassation de se prononcer.

La plus haute juridiction française n’a pas suivi la position du procureur général Rémy Heitz qui avait proposé lors de l’audience le 4 juillet de maintenir le mandat d’arrêt contre Bachar al-Assad, en écartant l’immunité personnelle dont il bénéficiait car la France ne le considérait plus depuis 2012 comme le « chef d’Etat légitime en exercice » eu égard aux « crimes de masse commis par le pouvoir syrien ».

Publicité

A lire aussi

En revanche, la Cour de Cassation a reconnu pour la première fois une exception à l’immunité fonctionnelle dont bénéficient les agents d’Etats étrangers s’ils sont poursuivis pour des crimes de guerre et des crimes contre l’humanité. La mise en examen pour complicité d’un ancien gouverneur de la Banque centrale syrienne (2005-2016) et ex-ministre de l’Economie (2016-2017), Adib Mayaleh, est donc validée.",56,confidence_weighted,"Des enfants assis sur des anneaux olympiques à côté de la Tour Eiffel à Paris, le temps d'un week-end de fête et de détente. Des enfants assis sur des anneaux olympiques à côté de la Tour Eiffel à Paris, le temps d'un week-end de fête et de détente. Des enfants assis sur des anneaux olympiques à côté de la Tour Eiffel à Paris, le temps d'un week-end de fête et de détente. Des enfants assis sur des anneaux olympiques à côté de la Tour Eiffel à Paris, le temps d'un week-end de fête et de détente. Des enfants assis sur des anneaux olympiques à côté de la Tour Eiffel à Paris, le temps d'un week-end de fête et de détente. Les Jeux olympiques de Paris 2024 auront lieu samedi 26 juillet. Une parade nautique d'une centaine de canoés, de kayaks et de paddles commencera cette journée. Le projet de ""monument des championnes"" qui sera installé sur le pont Saint-Louis à la fin de 2025 sera dévoilé. Les Jeux olympiques de Paris 2024 auront lieu samedi 26 juillet. Une parade nautique d'une centaine de canoés, de kayaks et de paddles commencera cette journée. Le projet de ""monument des championnes"" qui sera installé sur le pont Saint-Louis à la fin de 2025 sera dévoilé. Les Jeux olympiques de Paris 2024 auront lieu samedi 26 juillet. Une parade nautique d'une centaine de canoés, de kayaks et de paddles commencera cette journée. Le projet de ""monument des championnes"" qui sera installé sur le pont Saint-Louis à la fin de 2025 sera dévoilé. Les Jeux olympiques de Paris 2024 auront lieu samedi 26 juillet. Une parade nautique d'une centaine de canoés, de kayaks et de paddles commencera cette journée. Le projet de ""monument des championnes"" qui sera installé sur le pont Saint-Louis à la fin de 2025 sera dévoilé. Les Jeux olympiques de Paris 2024 auront lieu samedi 26 juillet. Une parade nautique d'une centaine de canoés, de kayaks et de paddles commencera cette journée. Le projet de ""monument des championnes"" qui sera installé sur le pont Saint-Louis à la fin de 2025 sera dévoilé.",0.3511,0.8428,re_summarize,cw_critical_with_text,True,True,en,True,0.0189393939393939
67_confidence_weighted,CRITICAL,False,0.1,0.2,0.303004664583427,0.6369819045066833,5,0.0,Grade D non production ready - traitement ML critique,D,False,1.0,0fef8f52921322f5,0,,,0fef8f52921322f5,0fef8f52921322f5,"Bachar al-Assad face à la justice française : « Si la Cour de Cassation confirme le mandat d’arrêt, ce sera une première mondiale »",https://www.nouvelobs.com/justice/20250725.OBS106196/bachar-al-assad-face-a-la-justice-francaise-si-la-cour-de-cassation-confirme-le-mandat-d-arret-ce-sera-une-premiere-mondiale.html,67,"Un portrait de Bachar al-Assad dans une benne à ordures à l’entrée d’un aérodrome militaire de la province d’Alep, le 3 décembre 2024, après la prise de la zone par des groupes rebelles. Le dictateur syrien sera renversé cinq jours plus tard. RAMI AL SAYED/AFP

Lire plus tard Google Actualités Partager Masquer ce message Vous souhaitez partager cet article ? Facebook Bluesky E-mail Copier le lien Saisir ici votre nom Adresse email des ou du destinataire Votre message S’abonner pour lire

Une décision lourde d’enjeux, scrutée en France et à l’étranger : la Cour de Cassation doit dire ce vendredi 25 juillet si elle maintient ou annule le mandat d’arrêt visant le président syrien déchu Bachar al-Assad. Tout a commencé en novembre 2023 quand deux juges d’instruction du pôle crimes contre l’humanité du tribunal judiciaire de Paris, à partir d’une plainte déposée en 2021, ont émis un mandat pour complicité de crimes de guerre et de crimes contre l’humanité contre l’ancien dictateur de Damas, renversé en décembre 2024, dans le cadre de deux attaques chimiques amputées à son régime en août 2013, à Adra et Douma (450 blessés) puis dans la Ghouta orientale (plus de mille morts). Le Parquet national antiterroriste l’a contesté, défendant l’immunité absolue devant les tribunaux étrangers dont jouissent les chefs d’Etat, Premiers ministres et ministres des Affaires étrangères en exercice. Mais la cour d’appel de Paris a validé le mandat en juin 2024. Le parquet général a alors saisi la Cour de Cassation.

Publicité

Le 4 juillet, la plus haute juridiction française a analysé la question en assemblée plénière, sa formation la plus solennelle. Celle-ci n’intervient que lorsque la question posée est particulièrement sensible ou complexe, ou susceptible de faire évoluer la jurisprudence. En l’occurrence : existe-t-il des exceptions à l’immunité personnelle d’un chef d’Etat étranger s’il est soupçonné de crimes de guerre ou de crimes contre l’humanité ? La décis…",67,confidence_weighted,"A son arrivée à la tête d’Orange, Christel Heydemann décidait d'un recentrage de l’activité autour des télécoms, du marché entreprise et de la cybersécurité. A son arrivée à la tête d’Orange, Christel Heydemann décidait d'un recentrage de l’activité autour des télécoms, du marché entreprise et de la cybersécurité. A son arrivée à la tête d’Orange, Christel Heydemann décidait d'un recentrage de l’activité autour des télécoms, du marché entreprise et de la cybersécurité. A son arrivée à la tête d’Orange, Christel Heydemann décidait d'un recentrage de l’activité autour des télécoms, du marché entreprise et de la cybersécurité. A son arrivée à la tête d’Orange, Christel Heydemann décidait d'un recentrage de l’activité autour des télécoms, du marché entreprise et de la cybersécurité. Orange Cyberdefense rachète une entreprise suisse basée à Zurich. La filiale spécialisée s'empare de 100 % de l'une des entreprises suisses. Les modalités financières de la transaction ne sont pas communiquées par Orange. Orange Cyberdefense rachète une entreprise suisse basée à Zurich. La filiale spécialisée s'empare de 100 % de l'une des entreprises suisses. Les modalités financières de la transaction ne sont pas communiquées par Orange. Orange Cyberdefense rachète une entreprise suisse basée à Zurich. La filiale spécialisée s'empare de 100 % de l'une des entreprises suisses. Les modalités financières de la transaction ne sont pas communiquées par Orange. Orange Cyberdefense rachète une entreprise suisse basée à Zurich. La filiale spécialisée s'empare de 100 % de l'une des entreprises suisses. Les modalités financières de la transaction ne sont pas communiquées par Orange. Orange Cyberdefense rachète une entreprise suisse basée à Zurich. La filiale spécialisée s'empare de 100 % de l'une des entreprises suisses. Les modalités financières de la transaction ne sont pas communiquées par Orange.",0.303,0.637,re_summarize,cw_critical_with_text,True,True,fr,False,0.0050761421319796
109_confidence_weighted,CRITICAL,False,0.1499991615535892,0.2,0.392596384668763,0.8123365640640259,5,0.0,Grade D non production ready - traitement ML critique,D,False,1.0,1799497d236cc8f8,0,,,1799497d236cc8f8,1799497d236cc8f8,Pourquoi mal travailler coûte plus cher que de ne pas travailler,https://www.nouvelobs.com/social/20250723.OBS106154/pourquoi-mal-travailler-coute-plus-cher-que-de-ne-pas-travailler.html,109,"Lire plus tard Google Actualités Partager Masquer ce message Vous souhaitez partager cet article ? Facebook Bluesky E-mail Copier le lien Saisir ici votre nom Adresse email des ou du destinataire Votre message S’abonner

Alors que le gouvernement cherche à réaliser 43,8 milliards d’euros d’économies en 2026, un autre gouffre continue de s’élargir, sans bruit : le mal-être au travail. Absentéisme chronique, burn-out massifs, démobilisation généralisée… Le travail, quand il rend malade ou indifférent, coûte plus qu’il ne rapporte.

A lire aussi

Selon l’indice IBET 2024 [PDF], ce désengagement collectif représente un coût annuel de 14 840 euros par salarié, soit près de 300 milliards d’euros par an. Plus de 10 % de notre PIB, évaporés dans l’indifférence !

Publicité

Pendant qu’on débat de coupes budgétaires, on ignore cette saignée silencieuse. Un paradoxe : on envisage de restreindre le remboursement des arrêts longs (notamment pour les cancers), mais on laisse se propager une culture professionnelle qui génère, à elle seule, fatigue, anxiété, maladie et perte de sens.

Burn-out et dépression

L’absentéisme est passé de 3,2 % en 2019 à 4,5 % en 2024. Et 92 % des salariés français se disent non engagés dans leur travail, plaçant la France à l’avant-dernière place en Europe [Gallup, 2024]. Et parmi les absences de plus de trois mois, la moitié est liée à un burn-out, 47 % à une dépression [Prévia, 2025].

A lire aussi

Les entreprises en paient le prix en turnover, en arrêts non anticipés, en baisse de qualité, en retards, en perte de compétitivité… L’Etat en paie les conséquences par l’intermédiaire de la Sécurité sociale, la hausse des indemnités journalières, et les multiples coûts cachés liés au désengagement collectif. Nous portons une proposition simple, concrète et ambitieuse : ériger le bien-être au travail comme cause nationale dès 2026, année électorale. Pourquoi ? Parce que cette reconnaissance permettrait de :

mobiliser tous les acteurs publics et privés autour d’un même objectif ;

généraliser la mesure du bien-être au travail grâce à la création d’un indice sectoriel IBET obligatoire pour les entreprises de plus de 50 salariés, comme le préconise Victor Waknine, à l’origine de l’indicateur et de sa méthode de calcul fondée sur les impacts économiques du désengagement ;

conditionner certaines aides publiques à des engagements clairs en matière de qualité de vie au travail ;

et surtout, équiper toutes les organisations, y compris les TPE/PME, de leviers concrets et mesurables pour agir durablement.

Publicité

Redonner de l’énergie

Partout en France, des actions sont déjà mises en œuvre avec succès. Certaines entreprises misent sur la cohésion, la reconnaissance et la motivation collective, par l’intermédiaire d’approches fondées sur la gamification, les interactions sociales, et la culture du lien. D’autres développent des politiques de prévention et d’accompagnement personnalisé, pour soutenir les salariés en situation de vulnérabilité : parentalité, aidance, handicap, santé mentale, difficultés financières…

A lire aussi

La lutte contre la sédentarité s’intègre aussi dans le quotidien de travail, grâce à des horaires plus flexibles, à l’encouragement à l’activité physique et à la régénération mentale. Ces initiatives améliorent la santé, réduisent les arrêts, fidélisent les équipes, et renforcent la performance collective. Redonner du sourire au travail, c’est redonner du souffle à notre économie. Il existe un gisement d’économies massif, populaire et humainement juste. Il ne demande qu’à être reconnu, structuré et amplifié.

Nous sommes convaincus qu’un changement systémique est possible. Pour cela, nous appelons les acteurs publics, les employeurs, les partenaires sociaux, les acteurs de la santé et du bien-être au travail à reprendre ces mesures. Ensemble, faisons du bien-être au travail une cause nationale en 2026. Et transformons enfin une dépense invisible en levier de croissance durable pour la France.

Delphine Cochet , PDG de Ma Bonne Fée (groupe Menway) ;

, PDG de Ma Bonne Fée (groupe Menway) ; Rony Msika , cofondateur de Corpogames ;

, cofondateur de Corpogames ; Jennifer Sitruk, directrice France d’EGYM Wellpass (ex-Gymlib).

Cet article est une tribune, rédigée par un auteur extérieur au journal et dont le point de vue n’engage pas la rédaction.",109,confidence_weighted,"Il s’est adressé à la Nation du président Tiani à l’occasion du 2e anniversaire du Conseil national pour la sauvegarde de la patrie (CNSP), diffusé sur la RTN le . Il s’est adressé à la Nation du président Tiani à l’occasion du 2e anniversaire du Conseil national pour la sauvegarde de la patrie (CNSP), diffusé sur la RTN le . Il s’est adressé à la Nation du président Tiani à l’occasion du 2e anniversaire du Conseil national pour la sauvegarde de la patrie (CNSP), diffusé sur la RTN le . Il s’est adressé à la Nation du président Tiani à l’occasion du 2e anniversaire du Conseil national pour la sauvegarde de la patrie (CNSP), diffusé sur la RTN le . Il s’est adressé à la Nation du président Tiani à l’occasion du 2e anniversaire du Conseil national pour la sauvegarde de la patrie (CNSP), diffusé sur la RTN le . Le général abdourahamane tiani s'est adressé à ses concitoyens dans un message radiotélévisé. Il a accusé les forces néocoloniales d'entraver le développement de son pays souverain. Le général abdourahamane tiani s'est adressé à ses concitoyens dans un message radiotélévisé. Il a accusé les forces néocoloniales d'entraver le développement de son pays souverain. Le général abdourahamane tiani s'est adressé à ses concitoyens dans un message radiotélévisé. Il a accusé les forces néocoloniales d'entraver le développement de son pays souverain. Le général abdourahamane tiani s'est adressé à ses concitoyens dans un message radiotélévisé. Il a accusé les forces néocoloniales d'entraver le développement de son pays souverain. Le général abdourahamane tiani s'est adressé à ses concitoyens dans un message radiotélévisé. Il a accusé les forces néocoloniales d'entraver le développement de son pays souverain.",0.3926,0.8123,re_summarize,cw_critical_with_text,True,True,fr,False,0.0028169014084507
