summary_id,tier,is_valid,validation_confidence,grade_score,coherence_score,factuality_score,issues_count,processing_time_ms,justification,original_grade,production_ready,level3_priority_final,source_id_x,tier_rank,source_id_m1,source_id_m2,source_id_filled,source_id_y,title,url,article_id_x,text,article_id_y,strategy,summary_before,n1_coherence,n1_factuality,l3_mode,mode_reason,has_text,enough_length,lang,lang_mismatch,topic_overlap_before_text
7_confidence_weighted,CRITICAL,False,0.1,0.2,0.3016747270187687,0.8915548324584961,6,0.0,Grade D non production ready - traitement ML critique,D,False,1.0,2e5d424af642656f,0,,,2e5d424af642656f,2e5d424af642656f,Pro-Palestinian convict freed by France after 41 years,https://www.bbc.com/news/articles/cvg8gmly8gno,7,"Pro-Palestinian convict freed by France after 41 years

23 hours ago Share Save Hugh Schofield Paris correspondent Share Save

AFP Georges Abdallah is due to be deported to Lebanon

Georges Abdallah, a 74-year-old Lebanese teacher who became a left-wing symbol for the Palestinian cause, has been freed by France on Friday after 41 years in jail. Described by his lawyer as ""the man who has spent the longest time in prison for events linked to the Israeli-Palestinian conflict,"" Abdallah left jail in the south of France in the early hours of Friday and was due to be put on a flight directly to Beirut. Convicted in 1987 for complicity in the murders in France of two diplomats – one American, one Israeli – Abdallah has gradually been forgotten by the wider public. But his release remained a cause célèbre for activists on the Marxist-Leninist left, with which he still identifies.

His stern-looking bearded face continued to peer from banners in left-wing demonstrations; and once a year protesters gathered to demand his freedom outside his prison in the Pyrenees. Three left-led French municipalities declared him an ""honorary citizen"". Though eligible for parole since 1999, he saw successive requests for liberty turned down. According to supporters, this was because of pressure on the French government from the US and Israel. Interviewed recently by the French news agency AFP at his cell in Lannemazan jail, he said he had kept sane by focusing on the Palestinian ""struggle"". ""If I had not had that… well, 40 years – it can turn your brain to mush,"" he said. On the walls of his cell, Abdallah kept a picture of the 1960s revolutionary Che Guevara and postcards from supporters around the world. A desk was covered with piles of newspapers.

AFP Abdallah was eventually released from Lannemezan prison in southern France in the early hours of Friday

Born in 1951 into a Christian family in northern Lebanon, in the late 1970s Abdallah helped set up the Lebanese Armed Revolutionary Factions (LARF) – a small Marxist group dedicated to fighting Israel and its closest ally, the United States. At the time Lebanon was embroiled in a civil war. In 1978 and again in 1982 Israel invaded south Lebanon to combat Palestinian fighters based there. Abdallah's group decided to hit Israeli and US targets in Europe, and carried out five attacks in France. In 1982 its members shot and killed US diplomat Charles Ray in Strasbourg, and Israeli diplomat Yakov Barsimantov in Paris. In addition a car bomb blamed on LARF killed two French bomb-disposal experts. Abdallah was arrested in Lyon in 1984. Tailed by French intelligence officers, he thought he was being followed by Israeli assassins and gave himself in at a police station. Initially he was charged only with having false passports and criminal association. A short time later a French citizen was kidnapped in northern Lebanon, and the French secret service entered a negotiation via Algeria to engineer an exchange. The French citizen was freed, but just before Abdallah was to be released police in Paris found a cache of weapons at his flat, including the gun used to kill the diplomats. This made his release impossible. Two years later in the run up to his trial, Paris was hit by a spate of attacks which killed 13 people. These were blamed by politicians and the media on allies of Abdallah trying to pressurise France into freeing him. Later it was established that in fact they were the work of the Lebanese Shia group Hezbollah, under instructions from Iran. In the trial, Abdallah denied involvement in the murders but defended their legitimacy. He was given a life sentence.

Getty Images Georges, seen here between two police officers, was convicted in the 1980s",7,confidence_weighted,"Partager Vous souhaitez Facebook Bluesky E-mail Copier le lien Saisir ici votre nom Adresse email des ou du destinataire Votre message S’abonner Loi Duplomb, lutte contre les renouvelables, fin des zones à faibles émissions, coup d’arrêt à la rénovation thermique des bâtiments, lois omnibus européennes pour défaire le « Green Deal »... A lire aussi Les dirigeants politiques de droite et d'extrême droite font aujourd’hui en France et en Europe le choix de singer le président américain Donald Trump en se lançant à leur tour dans une contre-révolution antiécologique. Mais en agissant ainsi, ils se trompent au sujet des aspirations de nos concitoyennes et concitoyens et le paieront probablement cher politiquement Partager Vous souhaitez Facebook Bluesky E-mail Copier le lien Saisir ici votre nom Adresse email des ou du destinataire Votre message S’abonner Loi Duplomb, lutte contre les renouvelables, fin des zones à faibles émissions, coup d’arrêt à la rénovation thermique des bâtiments, lois omnibus européennes pour défaire le « Green Deal »... A lire aussi Les dirigeants politiques de droite et d'extrême droite font aujourd’hui en France et en Europe le choix de singer le président américain Donald Trump en se lançant à leur tour dans une contre-révolution antiécologique. Mais en agissant ainsi, ils se trompent au sujet des aspirations de nos concitoyennes et concitoyens et le paieront probablement cher politiquement Partager Vous souhaitez Facebook Bluesky E-mail Copier le lien Saisir ici votre nom Adresse email des ou du destinataire Votre message S’abonner Loi Duplomb, lutte contre les renouvelables, fin des zones à faibles émissions, coup d’arrêt à la rénovation thermique des bâtiments, lois omnibus européennes pour défaire le « Green Deal »... A lire aussi Les dirigeants politiques de droite et d'extrême droite font aujourd’hui en France et en Europe le choix de singer le président américain Donald Trump en se lançant à leur tour dans une contre-révolution antiécologique. Mais en agissant ainsi, ils se trompent au sujet des aspirations de nos concitoyennes et concitoyens et le paieront probablement cher politiquement Partager Vous souhaitez Facebook Bluesky E-mail Copier le lien Saisir ici votre nom Adresse email des ou du destinataire Votre message S’abonner Loi Duplomb, lutte contre les renouvelables, fin des zones à faibles émissions, coup d’arrêt à la rénovation thermique des bâtiments, lois omnibus européennes pour défaire le « Green Deal »... A lire aussi Les dirigeants politiques de droite et d'extrême droite font aujourd’hui en France et en Europe le choix de singer le président américain Donald Trump en se lançant à leur tour dans une contre-révolution antiécologique. Mais en agissant ainsi, ils se trompent au sujet des aspirations de nos concitoyennes et concitoyens et le paieront probablement cher politiquement Partager Vous souhaitez Facebook Bluesky E-mail Copier le lien Saisir ici votre nom Adresse email des ou du destinataire Votre message S’abonner Loi Duplomb, lutte contre les renouvelables, fin des zones à faibles émissions, coup d’arrêt à la rénovation thermique des bâtiments, lois omnibus européennes pour défaire le « Green Deal »... A lire aussi Les dirigeants politiques de droite et d'extrême droite font aujourd’hui en France et en Europe le choix de singer le président américain Donald Trump en se lançant à leur tour dans une contre-révolution antiécologique. Mais en agissant ainsi, ils se trompent au sujet des aspirations de nos concitoyennes et concitoyens et le paieront probablement cher politiquement La pétition contre la loi Duplomb a dépassé le million de signatures malgré le fait qu'elle avait été lancée en plein mois de juillet. Les Français et les Français, plus largement les Européens, ne sont pas des Américains. Ils vivent dans des pays beaucoup plus densément peuplés que les États-Unis, qui ont subi plus longtemps les effets de pollution. La pétition contre la loi Duplomb a dépassé le million de signatures malgré le fait qu'elle avait été lancée en plein mois de juillet. Les Français et les Français, plus largement les Européens, ne sont pas des Américains. Ils vivent dans des pays beaucoup plus densément peuplés que les États-Unis, qui ont subi plus longtemps les effets de pollution. La pétition contre la loi Duplomb a dépassé le million de signatures malgré le fait qu'elle avait été lancée en plein mois de juillet. Les Français et les Français, plus largement les Européens, ne sont pas des Américains. Ils vivent dans des pays beaucoup plus densément peuplés que les États-Unis, qui ont subi plus longtemps les effets de pollution. La pétition contre la loi Duplomb a dépassé le million de signatures malgré le fait qu'elle avait été lancée en plein mois de juillet. Les Français et les Français, plus largement les Européens, ne sont pas des Américains. Ils vivent dans des pays beaucoup plus densément peuplés que les États-Unis, qui ont subi plus longtemps les effets de pollution. La pétition contre la loi Duplomb a dépassé le million de signatures malgré le fait qu'elle avait été lancée en plein mois de juillet. Les Français et les Français, plus largement les Européens, ne sont pas des Américains. Ils vivent dans des pays beaucoup plus densément peuplés que les États-Unis, qui ont subi plus longtemps les effets de pollution.",0.3017,0.8916,re_summarize,cw_critical_with_text,True,True,fr,True,0.0050761421319796
8_confidence_weighted,CRITICAL,False,0.1,0.2,0.3286540308094263,0.8446868658065796,6,0.0,Grade D non production ready - traitement ML critique,D,False,1.0,4545a3e73854234a,0,,,4545a3e73854234a,4545a3e73854234a,"Southwest flight plummets, injuring flight attendants",https://www.bbc.com/news/articles/c0l68811dkjo,8,"Southwest flight plummets, injuring flight attendants

The Federal Aviation Administration (FAA) said it was investigating the ""incident"". It comes less than one week after a similar near-miss.

The crew ""responded to two onboard traffic alerts... requiring them to climb and descend to comply with the alerts"", Southwest said in a statement.

Flight 1496 from Hollywood Burbank Airport to Las Vegas plummeted rapidly, lifting passengers out of their seats and injuring two flight attendants.

A Southwest Airlines plane rapidly dropped in elevation after departing from the Los Angeles area on Friday, with passengers posting online that the pilot was forced to rapidly change course to avoid a potential collision with another aircraft.

""Ensuring the safety of everyone in the national airspace system remains our top priority,"" the FAA statement added.

Stand-up comedian Jimmy Dore was onboard the plane, and was among the passengers saying that the erratic move was due to a near-miss with another plane.

""Pilot said his collision warning went off & he needed to avoid plane coming at us. Wow,"" Dore wrote on X. ""A flight attendant needed medical attention.""

His colleague Stef Zamorano added that all the passengers applauded when the plane landed.

Caitlin Burdi told Fox News that passengers were ""screaming"" as the plane rapidly fell.

""It was terrifying. We really thought we were plummeting to a plane crash,"" she said.

She added that the pilot came over the speaker afterwards to say that the plane had almost hit another plane, and that they had lost contact with air traffic control.

""I just remember him saying, 'What just happened was we almost collided with another plane, and I had to make the emergency attempt to go under because we lost service with the air traffic controller,'"" she said.

According to CNN, the plane was nearly intercepted by a privately owned Hawker Hunter fighter jet after less than six minutes in the air.

The jet crossed less than two miles in front of it, and within a few hundred feet of its altitude, CNN reported, citing flight tracking data. It had departed from El Pas, Texas and was flying to Oxnard, California.

The Southwest statement said that the flight continued on to Las Vegas, ""where it landed uneventfully"", and that the airline is ""engaged"" with the FAA ""to further understand the circumstances"".

""We appreciate the professionalism of our Flight Crew and Flight Attendants in responding to this event. Nothing is more important to Southwest than the Safety of our Customers and Employees.""

It comes less than one week after a Delta regional flight from Minneapolis was forced to make a sudden evasive manoeuvre to avoid a US military bomber.",8,confidence_weighted,"OMAR AL- Partager Vous souhaitez Facebook Bluesky E-mail Copier le lien Saisir ici votre nom Adresse email des ou du destinataire Votre message S’abonner La Défense civile de la bande de Gaza a affirmé dimanche que 57 Palestiniens avaient été tués et des dizaines blessés par des « tirs israéliens » près d’un point de distribution d'aide humanitaire dans la zone de Zikim, au nord du territoire palestinien ravagé par la guerre. OMAR AL- Partager Vous souhaitez Facebook Bluesky E-mail Copier le lien Saisir ici votre nom Adresse email des ou du destinataire Votre message S’abonner La Défense civile de la bande de Gaza a affirmé dimanche que 57 Palestiniens avaient été tués et des dizaines blessés par des « tirs israéliens » près d’un point de distribution d'aide humanitaire dans la zone de Zikim, au nord du territoire palestinien ravagé par la guerre. OMAR AL- Partager Vous souhaitez Facebook Bluesky E-mail Copier le lien Saisir ici votre nom Adresse email des ou du destinataire Votre message S’abonner La Défense civile de la bande de Gaza a affirmé dimanche que 57 Palestiniens avaient été tués et des dizaines blessés par des « tirs israéliens » près d’un point de distribution d'aide humanitaire dans la zone de Zikim, au nord du territoire palestinien ravagé par la guerre. OMAR AL- Partager Vous souhaitez Facebook Bluesky E-mail Copier le lien Saisir ici votre nom Adresse email des ou du destinataire Votre message S’abonner La Défense civile de la bande de Gaza a affirmé dimanche que 57 Palestiniens avaient été tués et des dizaines blessés par des « tirs israéliens » près d’un point de distribution d'aide humanitaire dans la zone de Zikim, au nord du territoire palestinien ravagé par la guerre. OMAR AL- Partager Vous souhaitez Facebook Bluesky E-mail Copier le lien Saisir ici votre nom Adresse email des ou du destinataire Votre message S’abonner La Défense civile de la bande de Gaza a affirmé dimanche que 57 Palestiniens avaient été tués et des dizaines blessés par des « tirs israéliens » près d’un point de distribution d'aide humanitaire dans la zone de Zikim, au nord du territoire palestinien ravagé par la guerre. 57 Palestiniens tués et des dizaines blessés par des « tirs israéliens » près d'un point de distribution. Des milliers de personnes étaient rassemblées, toutes cherchant à obtenir de la farine », raconte Qassem Abou Khater. Le péon XIV a reçu vendredi un éléphonique du Premier ministre Israélien Benjamin Netanyahu. 57 Palestiniens tués et des dizaines blessés par des « tirs israéliens » près d'un point de distribution. Des milliers de personnes étaient rassemblées, toutes cherchant à obtenir de la farine », raconte Qassem Abou Khater. Le péon XIV a reçu vendredi un éléphonique du Premier ministre Israélien Benjamin Netanyahu. 57 Palestiniens tués et des dizaines blessés par des « tirs israéliens » près d'un point de distribution. Des milliers de personnes étaient rassemblées, toutes cherchant à obtenir de la farine », raconte Qassem Abou Khater. Le péon XIV a reçu vendredi un éléphonique du Premier ministre Israélien Benjamin Netanyahu. 57 Palestiniens tués et des dizaines blessés par des « tirs israéliens » près d'un point de distribution. Des milliers de personnes étaient rassemblées, toutes cherchant à obtenir de la farine », raconte Qassem Abou Khater. Le péon XIV a reçu vendredi un éléphonique du Premier ministre Israélien Benjamin Netanyahu. 57 Palestiniens tués et des dizaines blessés par des « tirs israéliens » près d'un point de distribution. Des milliers de personnes étaient rassemblées, toutes cherchant à obtenir de la farine », raconte Qassem Abou Khater. Le péon XIV a reçu vendredi un éléphonique du Premier ministre Israélien Benjamin Netanyahu.",0.3287,0.8447,re_summarize,cw_critical_with_text,True,True,fr,True,0.0
