text_id,fusion_strategy,summary,length,rouge1_f,bertscore_f1,factuality,coherence,readability,engagement,info_density,composite_score
0,adaptive,"Avec l’IA, il est possible de suivre à la trace une personne en se servant des ondes Wi-Fi. Des chercheurs italiens ont en effet mis au point un système de surveillance qui analyse la manière dont chaque corps humain perturbe les signaux Wi... Une empreinte invisible dans le monde moderne, même à travers les murs d’un bâtiment, en analysant la position et les mouvements des corps humains en temps réel. Là encore, les chercheurs s’étaient servi de la biométrie pour interpréter et analyser les données. de 01net, et Whats.",89,,,0.9026752710342407,0.2487837887085282,0.6034312921348315,0.4946666666666667,0.12199036918138041,0.6168802114965428
1,adaptive,"Les milliers de personnes virées de Microsoft ne sont pas les seules à souffrir de cette situation. Elles seront certainement réconfortées de savoir que le dernier coup de hache dans les effectifs du groupe « pèse profondément » sur leur ancien patron, Satya Nadella. Ce dernier a publié un mémo pour faire le point sur la situation à Microsoft... et pour souligner la réussite de l’entreprise.",66,,,1.0,0.1645551541992895,0.5472012121212123,0.382,0.10545454545454545,0.5930594953968514
2,adaptive,"Et Microsoft a spécifiquement travaillé sur la connectivité, avec un nouveau système d'antennes dynamiques. L'équipé de six antennes, et ajuste la puissance de chacune pour un signal optimal. Le système peut ainsi s'adà la manière dont vous placez et interagissez avec l'ordinateur.",42,,,1.0,0.22080681145191194,0.5761904761904761,0.334,0.05056577086280056,0.5976820876229377
3,adaptive,"David Merron / Google / Getty Images Recevez une sélection de conseils stratégiques et d'astuces concrètes chaque semaine dans votre boîte mail avec notre newsletter Guides pratiques. En savoir plus sur l’utilisation des données personnelles DNS est l'acronyme de Domain Name System (système de noms de domaine). Il s'agit en quelque sorte de la commande resolvectl Comme vous pouvez le voir ci-dessous, le système de DNS fournit des informations sur les adresses IP et les noms des sites web que vous visitez régulièrement.",83,,,0.9034748077392578,0.27209239747635156,0.44979919678714864,0.41600000000000004,0.11485943775100402,0.5629568013559317
4,adaptive,"Le président américain avait récemment estimé que le chantier de rénovation pouvait avoir donné lieu à une « fraude », alimentant les spéculations sur un renvoi du patron de la Réserve fédérale. Nommé par Donald Trump pendant son premier mandat (2017-2021), Jerome Powell avait ensuite été reconduit par le démocrate Joe Biden.",52,,,0.9999998807907104,0.18022805705983588,0.4884615384615385,0.42066666666666663,0.19170673076923078,0.5906533543889274
5,adaptive,"Voici cinq arguments en faveur de cette bonne pratique. Préservez votre vie privée Chaque notification qui ît sur votre écran est un panneau d'affichage potentiel pour quiconque se trouve à proximité. Un SMS de votre moitié, une alerte bancaire, un courriel professionnel : ces çus fugaces peuvent révélateurs de vos habitudes.",51,,,0.9607664942741394,0.1676965734443149,0.5882352941176471,0.352,0.14309553608677514,0.5832637505281774
6,adaptive,"Par Le Nouvel Obs avec é le à 22h07 , mis à jour le À lire aussi Les baleiniers jété dans mon dos depuis quatorze ans et ma première arrestation à Francfort (Allemagne), en mai 2012 », a salué Paul Watson sur le site internet de sa fondation en faveur des océans, qui porte son nom. Publicité « a a été une incroyable traque par une nation très puissante, utilisant des ressources illimitées, mais je suis finalement libéré de leur vendetta et de cette persécution incessante », s’est-il encore félicité. Une arrestation qui serait « disproportionnée » Un porte-parole d’Interpol, l’organisation internationale de police criminelle, a confirmé à l'AFP que la Commission centrale",113,,,0.8889455795288086,0.17125295237914936,0.4418879056047198,0.5093333333333333,0.15752212389380532,0.562662661640641
7,adaptive,"Partager Vous souhaitez Facebook Bluesky E-mail Copier le lien Saisir ici votre nom Adresse email des ou du destinataire Votre message S’abonner Loi Duplomb, lutte contre les renouvelables, fin des zones à faibles émissions, coup d’arrêt à la rénovation thermique des bâtiments, lois omnibus européennes pour défaire le « Green Deal »... A lire aussi Les dirigeants politiques de droite et d'extrême droite font aujourd’hui en France et en Europe le choix de singer le président américain Donald Trump en se lançant à leur tour dans une contre-révolution antiécologique. Mais en agissant ainsi, ils se trompent au sujet des aspirations de nos concitoyennes et concitoyens et le paieront probablement cher politiquement",111,,,0.997988224029541,0.16654886504014332,0.4765765765765766,0.472,0.15895347402196716,0.5975650296606817
8,adaptive,"OMAR AL- Partager Vous souhaitez Facebook Bluesky E-mail Copier le lien Saisir ici votre nom Adresse email des ou du destinataire Votre message S’abonner La Défense civile de la bande de Gaza a affirmé dimanche que 57 Palestiniens avaient été tués et des dizaines blessés par des « tirs israéliens » près d’un point de distribution d'aide humanitaire dans la zone de Zikim, au nord du territoire palestinien ravagé par la guerre.",72,,,0.9999900460243225,1.0,0.3805555555555556,0.42733333333333334,0.1565040650406504,0.7019689042303299
9,adaptive,Par Le Nouvel Obs avec é le à 21h01 Lecture : 2 min. Illustration de la 49e édition du Festival International de l’édition (SNE) n’a pas donné suite.,28,,,0.7991381883621216,0.09604263305664062,0.7525885714285714,0.3393333333333333,0.16820987654320987,0.5553669778206235
10,adaptive,"Par Le Nouvel Obs avec é le à 15h46 , mis à jour le : à 16h18 Lecture : 1 min. Un portrait défiguré de l’ex président syrien Bachar al-Assad dans un centre de sécurité gouvernemental saccagé, à Damas, le , le jour du renversement de son régime.",48,,,0.99607253074646,0.1331467513527189,0.6793766666666666,0.3793333333333333,0.109375,0.6188928021409399
11,adaptive,"Les fréquences radio coûtent cher, et les opérateurs sont déjà à la manœuvre pour faire évoluer les modalités d'attributions. Selon la Tribune, Free aurait commencé à avancer l'idée d’une ""sécurisation des fréquences"" déjà attribuée lors du précédent processus, qui s'est déroulé en 2015. La majorité des nouvelles fréquences acquises par Free à cette occasion arriveront à échéance dapos;ici 2030 estiment les experts de l'Arcep.",64,,,0.9422397017478943,0.2938418634627995,0.578125,0.44466666666666665,0.18708881578947367,0.6187514611597646
12,adaptive,"Emmanuel Macron et le président syrien Ahmed al-Charaa lors d'une conférence de presse à l'Élysée, à Paris, le .",19,,,1.0000001192092896,1.0,0.6457231578947369,0.288,0.1636302294197031,0.7334308292101142
13,adaptive,"POLITIQUE - Il présentera le texte tel quel, sans s’arrêter sur les recommandations du Conseil d’État. Le projet de révision constitutionnelle sur la Corse, qui vise à octroyer à l’île « une autonomie dans la République », doit être présenté en Conseil des ministres mercredi prochain, mais il a tout pour déplaire aux élus de droite Les Républicains.",58,,,0.9941398501396179,0.3385048985481262,0.38275862068965516,0.366,0.15804597701149425,0.5749870883103075
14,adaptive,INTERNATIONAL - Comment parler d’une même voix sur la scène internationale lorsque l’on est en profond désaccord sur les choix les plus concrets ?,24,,,1.0,1.0,0.6652933333333333,0.298,0.025783828382838284,0.7408233333333334
15,adaptive,"Le , la Birmanie était secouée par un violent séisme de magnitudemagnitude 7,7 ayant occasionné d'importants dégâts. Fait rare, voire unique, la rupture de surface le long de la faille de Sagaing a été cée en direct par une caméra de vidéosurveillance.",42,,,1.0,0.12515409641406117,0.580952380952381,0.5423333333333333,0.13265306122448978,0.6350137779737722
16,adaptive,"En effet, nous r, bien qu'actuellement influencé par le réchauffement climatique d'origine anthropique, reste soumis à des forces géologiques puissantes qui opèrent sur des échelles temporelles dépassant largement l'histoire humaine.",30,,,0.989346444606781,1.0,0.35333333333333333,0.31,0.05220125786163522,0.6622821482022604
17,adaptive,"rédaction de l’article à partir d’un point de vue numérique, la démocratie n’est pas moins forte que le mouvement des « gilets jaunes » et on notera que notre démocratie est plus forte.",33,,,0.8219472169876099,1.0,0.41535333333333335,0.316,0.0,0.6234874056625367
18,adaptive,"Si vous avez déjà utilisé un service de transcription par IA pour des réunions, des , des conférences, etc., vous savez à quel point cette technologie est performante pour cétail d'une conversation et la convertir en texte. Imaginez un monde où vous pourriez accéder à une transcription générée par iA de chacune de vos interactions réelles. C’est ce que propose Bee AI-wearable, dont Amazon vient de faire l’acquisition. Toute l'actualité de la tech pour les pros chaque jour dans notre newsletter En savoir plus sur l'utilisation des données personnelles Le concept de BeE est simple : un bracelet à 49 équipé de micros et d’IA, qui écoute les interactions quotidiennes, les retranscrit et fournit",114,,,0.9675357937812805,0.29978643133566185,0.4754385964912281,0.5113333333333333,0.11632341723874905,0.6191693189391776
19,adaptive,"Linux est bien plus sûr que le système d'exploitation que vous utilisez, vous n'avez donc pas à vous soucier de payer pour un logiciel anti-malware ou un pare-feu tiers. Installez Linux et profitez de la sécurité! 5.",37,,,0.9974556565284729,0.20466232399145762,0.574178918918919,0.35733333333333334,0.05633001422475107,0.5994736692377971
20,adaptive,"Après avoir découvert le fonctionnement de Recall, les utilisateurs Windows ont exprimé des inquiétudes, tandis que certains experts en sécurité le qualifient de « cauchemar en matière de confidentialité ». En réponse aux plaintes, Microsoft a peaufiné recall au cours de l'année écoulée, offrant davantage de contrôle sur son fonctionnement et ses paramètres. Brave a fourni plus de détails sur cette solution de contournement via une page GitHub. Bien que ce n'est pas le cas de tous les autres navigateurs, il est possible d'utiliser les mêmes paramètres que ceux utilisés par le navigateur de Microsoft.",95,,,0.876602828502655,0.14971032290647326,0.47684210526315796,0.43999999999999995,0.10224646983311939,0.54636318963442
21,adaptive,"Un avion de la compagnie Vueling à l’aéroport de Gatwick à Londres, le . JAKUB PORZYCKI / NUR Partager Vous souhaitez Facebook Bluesky E-mail Copier le lien Saisir ici votre nom Adresse email des ou du destinataire Votre message S’abonner Une cinquantaine d’adolescents français de confession juive qui rentraient de vacances en Espagne ont été brutalement débarqués d’« un avion, ».",61,,,0.9603608250617981,0.16915902660952675,0.48032786885245904,0.372,0.17221394270574597,0.561395413335302
22,adaptive,"Par Le Nouvel Obs avec é le à 19h32 , mis à jour le 20 juin, le ministère du Logement a annoncé que les aides Ménov’ étaient d’ores et déjà en cours et que l’Etat avait arrêté une liste des dossiers à traiter entre le mois de juin et le début de la fin juin.",55,,,0.5475156903266907,1.0,0.4448018181818183,0.3933333333333333,0.07873900293255132,0.5587056846543514
23,adaptive,"Par Le Nouvel Obs avec AFP Publié le à 13h25 , mis à jour le : à 16h17 Lecture : 2 min. Bertrand Cantat au festival des Eurockéennes de Belfort, le .",32,,,0.961173951625824,0.09736586476747806,0.8914900000000001,0.3473333333333333,0.14368872549019607,0.6463247946698544
24,adaptive,"L'une représente une communauté francophone très vivante, l'autre est une organisation à but non lucratif fondée en Californie: Open SourceFr.",20,,,0.7335177063941956,1.0,0.55,0.29,0.060989010989010994,0.6211725687980653
25,adaptive,"On va bientôt fêter les 30 ans de la découverte par les Suisses Michel Mayor et Didier Queloz de l'une des exoplanètes, la plus jeune des planètes du système solaire.",30,,,0.9066699743270874,1.0,0.4273466666666669,0.3433333333333333,0.08864468864468865,0.6615599914423627
26,adaptive,"La vidéo de l’article est un exemple d’une campagne de désinformation qui a été lancée par la Fondation Soros, et qui est également un moyen de communication pour les médias.",30,,,0.8033843040466309,1.0,0.3866666666666667,0.31,0.08376068376068377,0.608628101348877
27,adaptive,"L'armée israélienne a annoncé qu'un quart des enfants âgés de six mois à cinq ans et des femmes enceintes et allaitantes examinés la semaine dernière dans ses installations souffraient de malnutrition. Isral rejette toute responsabilité et accuse le Hamas de détourner l'aide, ce que le mouvement palestinien dément. ""Paix durable"" Berlin, Paris et Londres ont par ailleurs réitéré leur à la libération des otages israéliens et au désarmement du mouvement islamiste palestinien.",72,,,0.9241381287574768,0.1643861619853912,0.5027777777777778,0.394,0.07931286549707603,0.5596381810278352
28,adaptive,"L'ex-président syrien Bachar al-Assad a été renversé en décembre 2013 et n'est plus président, a-t-il déclaré.",16,,,0.5902926325798035,1.0,0.46509000000000006,0.31533333333333335,0.17837389380530974,0.5585367108599346
29,adaptive,"Selon le code des bonnes pratiques et les lignes directrices, la Commission européenne a publié ce jeudi 24 juillet son modèle de résumé des sources utilisées pour entraîner le modèle d’intelligence artificielle : un document très attendu des ayants droit.",40,,,0.9101421236991882,1.0,0.375,0.36333333333333334,0.05178571428571428,0.6546307078997294
30,adaptive,"Il s'agit de professionnels de tous les secteurs d'activité qui utilisent déjà l'IA pour commencer ou modifier leur travail. Selon Mme Roth, les entreprises qui ne recherchent pas les outils adés à tel ou tel rôle spécifique ne seront pas en mesure de récolter les fruits de l’IA. L'étude de Thomson a révélé que plus de la moitié (46 %) des organisations ont investi dans une nouvelle technologie alimentée par l'""IA au cours de sa propre entreprise. """,78,,,0.9523348808288574,0.24370466770352545,0.47700410256410275,0.43933333333333335,0.05864702673213311,0.5871467638678991
31,adaptive,"Ce jeudi 24 juillet, le CISPE, qui rassemble des fournisseurs de cloud européens, a déposé un recours devant le tribunal de l’Union européen.",23,,,1.0,1.0,0.591304347826087,0.3293333333333333,0.079923273657289,0.7301594202898551
32,adaptive,"Les députés dans l’hémicycle de l'Assemblée nationale ont reçu le plus de pétitions (141 pétitions) devant les Affaires sociales (73) et celles des Affaires économiques (43), dont relève (étrangement) la pétition contre la loi Duplomb, lancée par une étudiante.",39,,,0.7923498749732971,1.0,0.38974358974358975,0.42800000000000005,0.1608848667672197,0.6352191890936632
33,adaptive,"Le ministre de l’Economie et des finances ne s’autosaisit pas d’une crise de la balance des paiements, mais de sa dette.",21,,,0.7148224115371704,1.0,0.640301904761905,0.35866666666666663,0.05588351042896497,0.6546829467028664
34,adaptive,Les entreprises qui développent les outils d’IA à l’échelle mondiale doivent se conformer à la loi européenne sur la santé et la sécurité.,23,,,0.6701154708862305,1.0,0.5739130434782609,0.36266666666666664,0.048580301685891746,0.6241834178316421
35,adaptive,"On se souvient qu'à la fin du mois de juin de cette année 2025, la noosphère astronomique était entrée un peu en ébullition avec la mise en ligne des premières images fournies par l'Observatoire Vera-C.-Rubin (Vera C. Rubin Observatory, en abrégé VRO), anciennement nommé LSST.",45,,,0.9168684482574463,1.0,0.37777777777777777,0.3733333333333333,0.11630434782608697,0.66006726053026
36,adaptive,"La ministre de la Culture Rachida Dati lors d’une visite à Morlaix, en Bretagne, le . VINCENT FEURAY/HANS LUCAS VIA és Partager Vous souhaitez Facebook Bluesky E-mail Copier le lien Saisir ici votre nom Adresse email des ou du destinataire Votre message S’abonner Dans un texte de 151 pages, les magistrats instructeurs évoquent « un pacte de corruption » entre Rachida et Carlos Ghosn, ancien patron tout-puissant de Renault-Nissan. D’où leur renvoi en procès contre les juges du tribunal correctionnel de Paris.",82,,,0.9157224297523499,0.20142557864289842,0.5211382113821139,0.4473333333333333,0.16269727403156384,0.5809296258701282
37,adaptive,Il n’y a qu’à voir ce que les libéraux ont fait de l’héritage de la culture. L’idée est de faire un peu d’argent.,23,,,0.47294872999191284,0.08380557366070293,0.7780752173913044,0.296,0.02533625273694088,0.4401359766219142
38,adaptive,"Isral, la France et l’Arabie saoudite, le président d’un Etat palestinien à Jérusalem-Est, a annoncé jeudi 24 juillet Emmanuel Macron. « Cette décision imprudente ne sert que la propagande du Hamas et fait reculer le processus de paix. C’est un camouflet pour les victimes du 7-Octobre », a blâmé le chef de la diplomatie américaine.",55,,,0.7744740843772888,0.2085991375182631,0.6155157575757577,0.42666666666666664,0.14187779433681072,0.5534701571060796
39,adaptive,"La Cour internationale de Justice (CIJ) à la Haye, aux Pays-Bas, le 23 juillet, a rendu un avis « historique ».",21,,,0.7945106029510498,1.0,0.6791209523809526,0.3253333333333333,0.17285714285714285,0.6826171057455881
40,adaptive,"Il s’agit d’une plateforme réunissant des experts qui se consacrent à exposer les informations non vérifiées"", selon les mots du porte-parole du ministère russe des Affaires étrangères, Maria Zakharova.",29,,,0.9957470893859863,1.0,0.36551724137931035,0.308,0.057515643722540276,0.6669616734734898
41,adaptive,"La station balnéaire populaire, avec sa promenade et son parc d’attraction centenaire, l’endroit survit pour l'instant aux divers grands projets de promoteurs immobiliers. L’ancien commerçant n’a jamais voulu quitter la zone, et a été témoin des premiers projets immobiliers au milieu du XIXe siècle.",44,,,0.7815355062484741,0.17924389751946054,0.5727272727272728,0.33799999999999997,0.030189959294436908,0.5180676365178863
42,adaptive,"Au moins 97 % des Français en consomment, dont près de 9 sur 10 chaque semaine. Un aliment simple, courant, que l'on retrouve aussi bien au petit déjeuner que dans les quiches ou les pâtisseries. Et pourtant, il a longtemps été pointé du doigt. Son crime ? tre naturellement riche en cholestérol.",52,,,0.9594295620918274,0.07889951020479202,0.6926375384615385,0.45399999999999996,0.1668956043956044,0.6196191570134592
43,adaptive,Ce chiffre devrait continuer de grimper au cours des prochaines années grâce à la collecte à l’échelle des données des sites industriels de TotalEnergies. La compagnie s’engage dans un déploiement de masse sur deux ans avec la division Aspen Technology d’Emerson.,41,,,0.889445424079895,0.19186821755240946,0.575609756097561,0.33199999999999996,0.10264227642276422,0.5553622833097569
44,adaptive,"L’intelligence artificielle rejoint plus que jamais la géopolitique. La technologie est pour les États-Unis et son président Donald Trump un moyen d’affirmer sa domination économique et sa supériorité sur la Chine, son premier adversaire. Toute l’actualité de la tech avec TechCrunch.",41,,,0.8344650864601135,0.22667409442915704,0.48943089430894315,0.33199999999999996,0.1501806684733514,0.5212917681354665
45,adaptive,"Le fleuron européen des puces électroniques présente des résultats financiers en berne, pour le deuxième trimestre 2025. L’entreprise qui emploie près de 11 500 personnes en France est touchée par la baisse de la demande des voitures électriques dont elle fournit les semi-conducteurs.",43,,,1.0,0.1420156371754569,0.4767441860465117,0.43600000000000005,0.1379670760386726,0.5851886527075374
46,adaptive,"Plus d'un an ès la découverte des tags sur le Mémorial de la Shoah, à Paris, les quatre Bulgares soupçonnés d’en être les auteurs sont renvoyés devant un tribunal correctionnel. Une audience est ""envisagée fin octobre"" indique le parquet de Paris. Quatre hommes de nationalité bulgares, arrêtés dans le cadre de l'enquête sur les attentats de Londres et de Bruxelles en mai 2024, seront jugés en fin d 'année 2025 en France, a indiqué ce jeudi 26 juillet franceinfo auprès du procureur du chef de ""complicité des dégradations aggravées"" et pour ""association de malfaiteurs"". Actuellement, trois de ces hommes sont en détention provisoire.",103,,,0.9555639028549194,0.1742964616242334,0.47864077669902916,0.5559999999999999,0.21560963308536124,0.6062309053971028
47,adaptive,À la recherche d'un forfait 20 Go pas cher et sans engagement ? RED by SFR et NRJ Mobile proposent actuellement deux des offres les plus attractives du marché des forfaits mobiles.,32,,,0.9644334316253662,0.1584803024927775,0.7838150000000002,0.3473333333333333,0.05958686440677966,0.6306782776239183
48,adaptive,"Le dioxyde de titane est toujours massivement utilisé dans de nombreux produits non alimentaires : cosmétiques, crèmes solaires, dentifrices, médicaments, peintures, p, plastiquesplastiques... Résultat : une contamination omniprésente de l'environnement.",30,,,1.0,1.0,0.33999999999999997,0.31,0.049206349206349205,0.6625000000000001
49,adaptive,"Par Le Nouvel Obs avec é le à 21h42 Lecture : 1 min. Contrôle de police nocturne dans le Vieux Nice, le 14 juillet.",24,,,0.9325799345970154,0.1427571117168381,0.87168,0.36466666666666664,0.16911764705882354,0.6437394968184782
50,adaptive,"Pedro Pascal est Reed Richards, alias Mr. Fantastique, dans le reboot des aventures des « 4 Fantastiques : Premiers Pas », en salle le .",25,,,1.0,1.0,0.7555240000000001,0.3333333333333333,0.18268292682926832,0.7722143333333333
51,adaptive,"En Centrafrique, la pression s'accentue sur le gouvernement pour qu'il montre le chef rebelle et ex-ministre Armel Sayo, extradé du Cameroun en mai dernier et en détention préventive à Bangui. Il a été vu pour la dernière fois par sa famille le 6 juillet dernier, et a fait l'objet d'une enquête de la gendarmerie nationale.",55,,,0.8085412979125977,0.11336145069864062,0.48545454545454547,0.3933333333333333,0.12196969696969696,0.5081043107842758
52,adaptive,"Si vous souhaitez y accéder, vous devez accepter la catégorie de cookies Contenus tiers en cliquant sur le bouton ci-dessous. Lire la Vidéo HISTOIRE - Souviens-toi, 1983. François Bayrou a présenté les pistes du gouvernement pour assainir les finances publiques dans le budget 2026 et atteindre 44 milliards d’euros d'économies. Un plan de rigueur budgétaire qui r’austérité, en vérité moins sévère, mais qui a marqué les Français. C’était il y a plus de quarante ans, sous François Mitterrand.",78,,,0.9983360171318054,0.14424482342269684,0.5923076923076924,0.506,0.2185061315496098,0.6313963993579744
53,adaptive,Le groupe Meta a annoncé ce vendredi 25 juillet qu'il ne publiera plus de publicité à caractère politique sur ses plateformes dans l'Union européenne.,24,,,1.0000001192092896,1.0,0.5833333333333334,0.3313333333333333,0.11274509803921567,0.7286667064030965
54,adaptive,"Un humour qui n'est pas du goût du président des Etats-Unis. Mercredi 23 juillet, la série télévisée d'animation South Park a diffusé le premier épisode de sa 27e saison, intitulé Sermon on the Mount (""Sermon sur la montagne""), avec une cible principale : Donald Trump.",45,,,1.0,0.1040031760931015,0.5478855555555556,0.3733333333333333,0.18617571059431526,0.5809719182377392
55,adaptive,"Par Le Nouvel Obs avec é le à 21h30 Lecture : 1 min. Francois Bayrou à l’Elysée, le . J.E.",20,,,1.0,0.1648215651512146,0.9102533333333334,0.3233333333333333,0.1534090909090909,0.6692002608585358
56,adaptive,"Des enfants assis sur des anneaux olympiques à côté de la Tour Eiffel à Paris, le temps d'un week-end de fête et de détente.",24,,,0.9674214124679565,1.0,0.7159266666666666,0.298,0.07765151515151515,0.7426221374893189
57,adaptive,Les entreprises IA ont trouvé leur champion en la personne de Donald Trump. L’AI Action Plan du président américain leur donne en effet un chèque en blanc pour faire à peu près ce qu’elles veulent. Y compris piller les contenus protégés par le droit d’auteur.,45,,,1.0,0.14731542766094208,0.6933755555555556,0.33999999999999997,0.058333333333333334,0.6162297934990458
58,adaptive,"Le gouvernement veut aussi réformer le marché du travail et ""inciter à augmenter le temps de travail"", dit-il. Pour cela, il propose aux partenaires sociaux d'""inciter au rachat de jours de congé dans le respect des 4 semaines de congés et avec l’accord des employeurs et des salariés"", à l'image de ce qui existe déjà avec les RTT dans certaines entreprises.",61,,,0.9628560543060303,0.2294908216659059,0.5031601639344264,0.4053333333333333,0.04731743666169896,0.5863238626966011
59,adaptive,"Un sondage révèle qu'un Français sur deux ment sur ses vacances pour sauver les yeux d'une partie de sa famille, et que le fait de se dire que nos choix peuvent être jugés, ça peut être perçu comme une forme de mécanisme de protection qui va être plus valorisant pour préserver son image.",53,,,0.8047746419906616,1.0,0.39245283018867927,0.42266666666666663,0.08721601848286484,0.6387047548773905
