text_id,fusion_strategy,summary,length,rouge1_f,bertscore_f1,factuality,coherence,readability,engagement,info_density,composite_score
26,confidence_weighted,"La vidéo de l’article est un exemple d’une campagne de désinformation qui a été lancée par la Fondation Soros, et qui est également un moyen de communication pour les médias. La vidéo de l’article est un exemple d’une campagne de désinformation qui a été lancée par la Fondation Soros, et qui est également un moyen de communication pour les médias. La vidéo de l’article est un exemple d’une campagne de désinformation qui a été lancée par la Fondation Soros, et qui est également un moyen de communication pour les médias. La vidéo de l’article est un exemple d’une campagne de désinformation qui a été lancée par la Fondation Soros, et qui est également un moyen de communication pour les médias. La vidéo de l’article est un exemple d’une campagne de désinformation qui a été lancée par la Fondation Soros, et qui est également un moyen de communication pour les médias. La Fondation Soros s'est engagée à financer 10 millions d'euros pour promouvoir les droits des personnes LGBT en Moldavie. Selon une influenceuse pro-russe, il n'y a pas eu de financement pour ce plan. La présidente de la Moldova aurait annoncé une augmentation des bloqueurs de puberté. La Fondation Soros s'est engagée à financer 10 millions d'euros pour promouvoir les droits des personnes LGBT en Moldavie. Selon une influenceuse pro-russe, il n'y a pas eu de financement pour ce plan. La présidente de la Moldova aurait annoncé une augmentation des bloqueurs de puberté. La Fondation Soros s'est engagée à financer 10 millions d'euros pour promouvoir les droits des personnes LGBT en Moldavie. Selon une influenceuse pro-russe, il n'y a pas eu de financement pour ce plan. La présidente de la Moldova aurait annoncé une augmentation des bloqueurs de puberté. La Fondation Soros s'est engagée à financer 10 millions d'euros pour promouvoir les droits des personnes LGBT en Moldavie. Selon une influenceuse pro-russe, il n'y a pas eu de financement pour ce plan. La présidente de la Moldova aurait annoncé une augmentation des bloqueurs de puberté. La Fondation Soros s'est engagée à financer 10 millions d'euros pour promouvoir les droits des personnes LGBT en Moldavie. Selon une influenceuse pro-russe, il n'y a pas eu de financement pour ce plan. La présidente de la Moldova aurait annoncé une augmentation des bloqueurs de puberté.",380,,,0.6975960731506348,0.31646502665376797,0.5315789473684212,0.4118421052631579,0.2794646873594242,0.521131458650401
27,confidence_weighted,"L'armée israélienne a annoncé qu'un quart des enfants âgés de six mois à cinq ans et des femmes enceintes et allaitantes examinés la semaine dernière dans ses installations souffraient de malnutrition. Isral rejette toute responsabilité et accuse le Hamas de détourner l'aide, ce que le mouvement palestinien dément. ""Paix durable"" Berlin, Paris et Londres ont par ailleurs réitéré leur à la libération des otages israéliens et au désarmement du mouvement islamiste palestinien. L'armée israélienne a annoncé qu'un quart des enfants âgés de six mois à cinq ans et des femmes enceintes et allaitantes examinés la semaine dernière dans ses installations souffraient de malnutrition. Isral rejette toute responsabilité et accuse le Hamas de détourner l'aide, ce que le mouvement palestinien dément. ""Paix durable"" Berlin, Paris et Londres ont par ailleurs réitéré leur à la libération des otages israéliens et au désarmement du mouvement islamiste palestinien. L'armée israélienne a annoncé qu'un quart des enfants âgés de six mois à cinq ans et des femmes enceintes et allaitantes examinés la semaine dernière dans ses installations souffraient de malnutrition. Isral rejette toute responsabilité et accuse le Hamas de détourner l'aide, ce que le mouvement palestinien dément. ""Paix durable"" Berlin, Paris et Londres ont par ailleurs réitéré leur à la libération des otages israéliens et au désarmement du mouvement islamiste palestinien. L'armée israélienne a annoncé qu'un quart des enfants âgés de six mois à cinq ans et des femmes enceintes et allaitantes examinés la semaine dernière dans ses installations souffraient de malnutrition. Isral rejette toute responsabilité et accuse le Hamas de détourner l'aide, ce que le mouvement palestinien dément. ""Paix durable"" Berlin, Paris et Londres ont par ailleurs réitéré leur à la libération des otages israéliens et au désarmement du mouvement islamiste palestinien. L'armée israélienne a annoncé qu'un quart des enfants âgés de six mois à cinq ans et des femmes enceintes et allaitantes examinés la semaine dernière dans ses installations souffraient de malnutrition. Isral rejette toute responsabilité et accuse le Hamas de détourner l'aide, ce que le mouvement palestinien dément. ""Paix durable"" Berlin, Paris et Londres ont par ailleurs réitéré leur à la libération des otages israéliens et au désarmement du mouvement islamiste palestinien. Isra ?? l affirme que 90 000 Palestiniens et enfants ont besoin d'un traitement urgent. Le programme alimentaire mondial avertit que la malnutrition est en forte augmentation. L'ONU s'est engagée à ""lever immédiatement les restrictions sur les aides alimentaires"". Isra ?? l affirme que 90 000 Palestiniens et enfants ont besoin d'un traitement urgent. Le programme alimentaire mondial avertit que la malnutrition est en forte augmentation. L'ONU s'est engagée à ""lever immédiatement les restrictions sur les aides alimentaires"". Isra ?? l affirme que 90 000 Palestiniens et enfants ont besoin d'un traitement urgent. Le programme alimentaire mondial avertit que la malnutrition est en forte augmentation. L'ONU s'est engagée à ""lever immédiatement les restrictions sur les aides alimentaires"". Isra ?? l affirme que 90 000 Palestiniens et enfants ont besoin d'un traitement urgent. Le programme alimentaire mondial avertit que la malnutrition est en forte augmentation. L'ONU s'est engagée à ""lever immédiatement les restrictions sur les aides alimentaires"". Isra ?? l affirme que 90 000 Palestiniens et enfants ont besoin d'un traitement urgent. Le programme alimentaire mondial avertit que la malnutrition est en forte augmentation. L'ONU s'est engagée à ""lever immédiatement les restrictions sur les aides alimentaires"".",555,,,0.7593997120857239,0.18322921216104454,0.5407657657657658,0.3432432432432433,0.31721194879089615,0.5046736916410011
28,confidence_weighted,"L'ex-président syrien Bachar al-Assad a été renversé en décembre 2013 et n'est plus président, a-t-il déclaré. L'ex-président syrien Bachar al-Assad a été renversé en décembre 2013 et n'est plus président, a-t-il déclaré. L'ex-président syrien Bachar al-Assad a été renversé en décembre 2013 et n'est plus président, a-t-il déclaré. L'ex-président syrien Bachar al-Assad a été renversé en décembre 2013 et n'est plus président, a-t-il déclaré. L'ex-président syrien Bachar al-Assad a été renversé en décembre 2013 et n'est plus président, a-t-il déclaré. Le mandat d'arrêt visant le président syrien déchu Bachar al-Assad pour des attaques chimiques en 2013 qui ont fait plus de mille morts. La Cour de cassation a annulé, vendredi 25 juillet, le mandat. Le procureur général près de la Cour avait émis un mandat pour complicité de crimes contre l'humanité. Le mandat d'arrêt visant le président syrien déchu Bachar al-Assad pour des attaques chimiques en 2013 qui ont fait plus de mille morts. La Cour de cassation a annulé, vendredi 25 juillet, le mandat. Le procureur général près de la Cour avait émis un mandat pour complicité de crimes contre l'humanité. Le mandat d'arrêt visant le président syrien déchu Bachar al-Assad pour des attaques chimiques en 2013 qui ont fait plus de mille morts. La Cour de cassation a annulé, vendredi 25 juillet, le mandat. Le procureur général près de la Cour avait émis un mandat pour complicité de crimes contre l'humanité. Le mandat d'arrêt visant le président syrien déchu Bachar al-Assad pour des attaques chimiques en 2013 qui ont fait plus de mille morts. La Cour de cassation a annulé, vendredi 25 juillet, le mandat. Le procureur général près de la Cour avait émis un mandat pour complicité de crimes contre l'humanité. Le mandat d'arrêt visant le président syrien déchu Bachar al-Assad pour des attaques chimiques en 2013 qui ont fait plus de mille morts. La Cour de cassation a annulé, vendredi 25 juillet, le mandat. Le procureur général près de la Cour avait émis un mandat pour complicité de crimes contre l'humanité.",335,,,0.6679369211196899,0.3621281896925904,0.6352606716417912,0.4432835820895522,0.4437987055871087,0.5526364020881642
29,confidence_weighted,"Selon le code des bonnes pratiques et les lignes directrices, la Commission européenne a publié ce jeudi 24 juillet son modèle de résumé des sources utilisées pour entraîner le modèle d’intelligence artificielle : un document très attendu des ayants droit. Selon le code des bonnes pratiques et les lignes directrices, la Commission européenne a publié ce jeudi 24 juillet son modèle de résumé des sources utilisées pour entraîner le modèle d’intelligence artificielle : un document très attendu des ayants droit. Selon le code des bonnes pratiques et les lignes directrices, la Commission européenne a publié ce jeudi 24 juillet son modèle de résumé des sources utilisées pour entraîner le modèle d’intelligence artificielle : un document très attendu des ayants droit. Selon le code des bonnes pratiques et les lignes directrices, la Commission européenne a publié ce jeudi 24 juillet son modèle de résumé des sources utilisées pour entraîner le modèle d’intelligence artificielle : un document très attendu des ayants droit. Selon le code des bonnes pratiques et les lignes directrices, la Commission européenne a publié ce jeudi 24 juillet son modèle de résumé des sources utilisées pour entraîner le modèle d’intelligence artificielle : un document très attendu des ayants droit. La Commission européenne a publié ce jeudi 24 juillet son modèle de résumé des sources utilisées pour entraîner le modèle d'intelligence artificielle. Le modèle était très attendu des auteurs, des détenteurs de droits, et des fournisseurs de services génératifs tels que OpenAI (ChatGPT). Depuis le 2 août prochain, la loi sur l'AI devient contraignante pour les développeurs de modèles à portée générale. La Commission européenne a publié ce jeudi 24 juillet son modèle de résumé des sources utilisées pour entraîner le modèle d'intelligence artificielle. Le modèle était très attendu des auteurs, des détenteurs de droits, et des fournisseurs de services génératifs tels que OpenAI (ChatGPT). Depuis le 2 août prochain, la loi sur l'AI devient contraignante pour les développeurs de modèles à portée générale. La Commission européenne a publié ce jeudi 24 juillet son modèle de résumé des sources utilisées pour entraîner le modèle d'intelligence artificielle. Le modèle était très attendu des auteurs, des détenteurs de droits, et des fournisseurs de services génératifs tels que OpenAI (ChatGPT). Depuis le 2 août prochain, la loi sur l'AI devient contraignante pour les développeurs de modèles à portée générale. La Commission européenne a publié ce jeudi 24 juillet son modèle de résumé des sources utilisées pour entraîner le modèle d'intelligence artificielle. Le modèle était très attendu des auteurs, des détenteurs de droits, et des fournisseurs de services génératifs tels que OpenAI (ChatGPT). Depuis le 2 août prochain, la loi sur l'AI devient contraignante pour les développeurs de modèles à portée générale. La Commission européenne a publié ce jeudi 24 juillet son modèle de résumé des sources utilisées pour entraîner le modèle d'intelligence artificielle. Le modèle était très attendu des auteurs, des détenteurs de droits, et des fournisseurs de services génératifs tels que OpenAI (ChatGPT). Depuis le 2 août prochain, la loi sur l'AI devient contraignante pour les développeurs de modèles à portée générale.",510,,,0.8123286366462708,0.4061306876596452,0.5225490196078432,0.40490196078431373,0.2584033613445378,0.5703274052567371
30,confidence_weighted,"Il s'agit de professionnels de tous les secteurs d'activité qui utilisent déjà l'IA pour commencer ou modifier leur travail. Selon Mme Roth, les entreprises qui ne recherchent pas les outils adés à tel ou tel rôle spécifique ne seront pas en mesure de récolter les fruits de l’IA. L'étude de Thomson a révélé que plus de la moitié (46 %) des organisations ont investi dans une nouvelle technologie alimentée par l'""IA au cours de sa propre entreprise. "" Il s'agit de professionnels de tous les secteurs d'activité qui utilisent déjà l'IA pour commencer ou modifier leur travail. Selon Mme Roth, les entreprises qui ne recherchent pas les outils adés à tel ou tel rôle spécifique ne seront pas en mesure de récolter les fruits de l’IA. L'étude de Thomson a révélé que plus de la moitié (46 %) des organisations ont investi dans une nouvelle technologie alimentée par l'""IA au cours de sa propre entreprise. "" Il s'agit de professionnels de tous les secteurs d'activité qui utilisent déjà l'IA pour commencer ou modifier leur travail. Selon Mme Roth, les entreprises qui ne recherchent pas les outils adés à tel ou tel rôle spécifique ne seront pas en mesure de récolter les fruits de l’IA. L'étude de Thomson a révélé que plus de la moitié (46 %) des organisations ont investi dans une nouvelle technologie alimentée par l'""IA au cours de sa propre entreprise. "" Il s'agit de professionnels de tous les secteurs d'activité qui utilisent déjà l'IA pour commencer ou modifier leur travail. Selon Mme Roth, les entreprises qui ne recherchent pas les outils adés à tel ou tel rôle spécifique ne seront pas en mesure de récolter les fruits de l’IA. L'étude de Thomson a révélé que plus de la moitié (46 %) des organisations ont investi dans une nouvelle technologie alimentée par l'""IA au cours de sa propre entreprise. "" Il s'agit de professionnels de tous les secteurs d'activité qui utilisent déjà l'IA pour commencer ou modifier leur travail. Selon Mme Roth, les entreprises qui ne recherchent pas les outils adés à tel ou tel rôle spécifique ne seront pas en mesure de récolter les fruits de l’IA. L'étude de Thomson a révélé que plus de la moitié (46 %) des organisations ont investi dans une nouvelle technologie alimentée par l'""IA au cours de sa propre entreprise. "" L'enquête Future of Professionals Survey a interrogé 2 275 professionnels et cadres supérieurs de plus de 50 pays. Près des deux cinquièmes (38 %) s'attendent à voir ces changements dans leur organisation cette année. L'enquête Future of Professionals Survey a interrogé 2 275 professionnels et cadres supérieurs de plus de 50 pays. Près des deux cinquièmes (38 %) s'attendent à voir ces changements dans leur organisation cette année. L'enquête Future of Professionals Survey a interrogé 2 275 professionnels et cadres supérieurs de plus de 50 pays. Près des deux cinquièmes (38 %) s'attendent à voir ces changements dans leur organisation cette année. L'enquête Future of Professionals Survey a interrogé 2 275 professionnels et cadres supérieurs de plus de 50 pays. Près des deux cinquièmes (38 %) s'attendent à voir ces changements dans leur organisation cette année. L'enquête Future of Professionals Survey a interrogé 2 275 professionnels et cadres supérieurs de plus de 50 pays. Près des deux cinquièmes (38 %) s'attendent à voir ces changements dans leur organisation cette année.",560,,,0.8861552476882935,0.22315741537228584,0.5328702857142859,0.3392857142857143,0.37272036474164133,0.5506169851248123
31,confidence_weighted,"Ce jeudi 24 juillet, le CISPE, qui rassemble des fournisseurs de cloud européens, a déposé un recours devant le tribunal de l’Union européen. Ce jeudi 24 juillet, le CISPE, qui rassemble des fournisseurs de cloud européens, a déposé un recours devant le tribunal de l’Union européen. Ce jeudi 24 juillet, le CISPE, qui rassemble des fournisseurs de cloud européens, a déposé un recours devant le tribunal de l’Union européen. Ce jeudi 24 juillet, le CISPE, qui rassemble des fournisseurs de cloud européens, a déposé un recours devant le tribunal de l’Union européen. Ce jeudi 24 juillet, le CISPE, qui rassemble des fournisseurs de cloud européens, a déposé un recours devant le tribunal de l’Union européen. L'association « Cloud Infrastructure Service Providers in Europe » (CISPE) a déposé un recours devant le tribunal de l'Union européenne. Il vise à faire annuler la décision de la Commission européenne autorisant le rachat de VMWare par Broadcom. En juillet 2023, Bruxelles validait la vente de VMware, une société qui commercialise des logiciels de virtualisation. L'association « Cloud Infrastructure Service Providers in Europe » (CISPE) a déposé un recours devant le tribunal de l'Union européenne. Il vise à faire annuler la décision de la Commission européenne autorisant le rachat de VMWare par Broadcom. En juillet 2023, Bruxelles validait la vente de VMware, une société qui commercialise des logiciels de virtualisation. L'association « Cloud Infrastructure Service Providers in Europe » (CISPE) a déposé un recours devant le tribunal de l'Union européenne. Il vise à faire annuler la décision de la Commission européenne autorisant le rachat de VMWare par Broadcom. En juillet 2023, Bruxelles validait la vente de VMware, une société qui commercialise des logiciels de virtualisation. L'association « Cloud Infrastructure Service Providers in Europe » (CISPE) a déposé un recours devant le tribunal de l'Union européenne. Il vise à faire annuler la décision de la Commission européenne autorisant le rachat de VMWare par Broadcom. En juillet 2023, Bruxelles validait la vente de VMware, une société qui commercialise des logiciels de virtualisation. L'association « Cloud Infrastructure Service Providers in Europe » (CISPE) a déposé un recours devant le tribunal de l'Union européenne. Il vise à faire annuler la décision de la Commission européenne autorisant le rachat de VMWare par Broadcom. En juillet 2023, Bruxelles validait la vente de VMware, une société qui commercialise des logiciels de virtualisation.",390,,,0.9514681100845337,0.4406990216621234,0.5769230769230769,0.40512820512820513,0.40196078431372545,0.6361186941513524
32,confidence_weighted,"Les députés dans l’hémicycle de l'Assemblée nationale ont reçu le plus de pétitions (141 pétitions) devant les Affaires sociales (73) et celles des Affaires économiques (43), dont relève (étrangement) la pétition contre la loi Duplomb, lancée par une étudiante. Les députés dans l’hémicycle de l'Assemblée nationale ont reçu le plus de pétitions (141 pétitions) devant les Affaires sociales (73) et celles des Affaires économiques (43), dont relève (étrangement) la pétition contre la loi Duplomb, lancée par une étudiante. Les députés dans l’hémicycle de l'Assemblée nationale ont reçu le plus de pétitions (141 pétitions) devant les Affaires sociales (73) et celles des Affaires économiques (43), dont relève (étrangement) la pétition contre la loi Duplomb, lancée par une étudiante. Les députés dans l’hémicycle de l'Assemblée nationale ont reçu le plus de pétitions (141 pétitions) devant les Affaires sociales (73) et celles des Affaires économiques (43), dont relève (étrangement) la pétition contre la loi Duplomb, lancée par une étudiante. Les députés dans l’hémicycle de l'Assemblée nationale ont reçu le plus de pétitions (141 pétitions) devant les Affaires sociales (73) et celles des Affaires économiques (43), dont relève (étrangement) la pétition contre la loi Duplomb, lancée par une étudiante. La pétition contre la loi Duplomb déposée sur le site de l'Assemblée nationale a dépassé les 1,4 million de signatures lundi 21 juillet. La plateforme en ligne permet aux citoyens d'adresser des demandes aux assemblées nationales. Les députés de la commission désignent un député-r-examiner le texte. La pétition contre la loi Duplomb déposée sur le site de l'Assemblée nationale a dépassé les 1,4 million de signatures lundi 21 juillet. La plateforme en ligne permet aux citoyens d'adresser des demandes aux assemblées nationales. Les députés de la commission désignent un député-r-examiner le texte. La pétition contre la loi Duplomb déposée sur le site de l'Assemblée nationale a dépassé les 1,4 million de signatures lundi 21 juillet. La plateforme en ligne permet aux citoyens d'adresser des demandes aux assemblées nationales. Les députés de la commission désignent un député-r-examiner le texte. La pétition contre la loi Duplomb déposée sur le site de l'Assemblée nationale a dépassé les 1,4 million de signatures lundi 21 juillet. La plateforme en ligne permet aux citoyens d'adresser des demandes aux assemblées nationales. Les députés de la commission désignent un député-r-examiner le texte. La pétition contre la loi Duplomb déposée sur le site de l'Assemblée nationale a dépassé les 1,4 million de signatures lundi 21 juillet. La plateforme en ligne permet aux citoyens d'adresser des demandes aux assemblées nationales. Les députés de la commission désignent un député-r-examiner le texte.",425,,,0.7847729921340942,0.36821760479870574,0.5335294117647059,0.3847058823529411,0.37777777777777777,0.5525194217072275
33,confidence_weighted,"Le ministre de l’Economie et des finances ne s’autosaisit pas d’une crise de la balance des paiements, mais de sa dette. Le ministre de l’Economie et des finances ne s’autosaisit pas d’une crise de la balance des paiements, mais de sa dette. Le ministre de l’Economie et des finances ne s’autosaisit pas d’une crise de la balance des paiements, mais de sa dette. Le ministre de l’Economie et des finances ne s’autosaisit pas d’une crise de la balance des paiements, mais de sa dette. Le ministre de l’Economie et des finances ne s’autosaisit pas d’une crise de la balance des paiements, mais de sa dette. Le projet de loi de finances 2025 adopté en février dernier s'est singularisé par huit semaines de législation spéciale. Le gouvernement Bayrou décline depuis plusieurs mois un double narratif : l'annonce de mesures soldées par une économie de 40 milliards. Le projet de loi de finances 2025 adopté en février dernier s'est singularisé par huit semaines de législation spéciale. Le gouvernement Bayrou décline depuis plusieurs mois un double narratif : l'annonce de mesures soldées par une économie de 40 milliards. Le projet de loi de finances 2025 adopté en février dernier s'est singularisé par huit semaines de législation spéciale. Le gouvernement Bayrou décline depuis plusieurs mois un double narratif : l'annonce de mesures soldées par une économie de 40 milliards. Le projet de loi de finances 2025 adopté en février dernier s'est singularisé par huit semaines de législation spéciale. Le gouvernement Bayrou décline depuis plusieurs mois un double narratif : l'annonce de mesures soldées par une économie de 40 milliards. Le projet de loi de finances 2025 adopté en février dernier s'est singularisé par huit semaines de législation spéciale. Le gouvernement Bayrou décline depuis plusieurs mois un double narratif : l'annonce de mesures soldées par une économie de 40 milliards.",305,,,0.7308954000473022,0.38921034398700005,0.5868852459016394,0.608743169398907,0.2597209050264192,0.6074072945054041
