text_id,fusion_strategy,summary,length,rouge1_f,bertscore_f1,factuality,coherence,readability,engagement,info_density,composite_score
84,confidence_weighted,"Gaza a atteint des niveaux de désespoir sans précédent » Le Programme alimentaire mondial (PAM) de l'ONU ne fait pas le poids. Gaza a atteint des niveaux de désespoir sans précédent » Le Programme alimentaire mondial (PAM) de l'ONU ne fait pas le poids. Gaza a atteint des niveaux de désespoir sans précédent » Le Programme alimentaire mondial (PAM) de l'ONU ne fait pas le poids. Gaza a atteint des niveaux de désespoir sans précédent » Le Programme alimentaire mondial (PAM) de l'ONU ne fait pas le poids. Gaza a atteint des niveaux de désespoir sans précédent » Le Programme alimentaire mondial (PAM) de l'ONU ne fait pas le poids. L'armée israélienne affirme qu'elle autorisera l'aide humanitaire dans la bande de Gaza à partir de vendredi 25 juillet. Les Palestiniens attendent de recevoir de la nourriture près de bâtiments résidentiels détruits lors d'une offensive. La Jordanie devrait effectuer le premier largage, peut-être dès vendredi. L'armée israélienne affirme qu'elle autorisera l'aide humanitaire dans la bande de Gaza à partir de vendredi 25 juillet. Les Palestiniens attendent de recevoir de la nourriture près de bâtiments résidentiels détruits lors d'une offensive. La Jordanie devrait effectuer le premier largage, peut-être dès vendredi. L'armée israélienne affirme qu'elle autorisera l'aide humanitaire dans la bande de Gaza à partir de vendredi 25 juillet. Les Palestiniens attendent de recevoir de la nourriture près de bâtiments résidentiels détruits lors d'une offensive. La Jordanie devrait effectuer le premier largage, peut-être dès vendredi. L'armée israélienne affirme qu'elle autorisera l'aide humanitaire dans la bande de Gaza à partir de vendredi 25 juillet. Les Palestiniens attendent de recevoir de la nourriture près de bâtiments résidentiels détruits lors d'une offensive. La Jordanie devrait effectuer le premier largage, peut-être dès vendredi. L'armée israélienne affirme qu'elle autorisera l'aide humanitaire dans la bande de Gaza à partir de vendredi 25 juillet. Les Palestiniens attendent de recevoir de la nourriture près de bâtiments résidentiels détruits lors d'une offensive. La Jordanie devrait effectuer le premier largage, peut-être dès vendredi.",330,,,0.8520048260688782,0.36785761537850836,0.5787878787878789,0.45606060606060606,0.14465333967951768,0.604023332464832
85,confidence_weighted,"Pour la deuxième journée consécutive, des affrontements à l’artillerie lourde ont éclaté entre la Thaïlande et le Cambodge. La communauté internationale s’alarme et plusieurs pays ont proposé leur médiation, pour l'instant sans succès. Le Cambodge, qui fait état de 13 morts et de 35 000 personnes ayant fui leur domicile, a réclamé vendredi 25 juillet un « cessez-le-feu immédiat » et « inconditionnel » avec la thaïlandaise. Pour la deuxième journée consécutive, des affrontements à l’artillerie lourde ont éclaté entre la Thaïlande et le Cambodge. La communauté internationale s’alarme et plusieurs pays ont proposé leur médiation, pour l'instant sans succès. Le Cambodge, qui fait état de 13 morts et de 35 000 personnes ayant fui leur domicile, a réclamé vendredi 25 juillet un « cessez-le-feu immédiat » et « inconditionnel » avec la thaïlandaise. Pour la deuxième journée consécutive, des affrontements à l’artillerie lourde ont éclaté entre la Thaïlande et le Cambodge. La communauté internationale s’alarme et plusieurs pays ont proposé leur médiation, pour l'instant sans succès. Le Cambodge, qui fait état de 13 morts et de 35 000 personnes ayant fui leur domicile, a réclamé vendredi 25 juillet un « cessez-le-feu immédiat » et « inconditionnel » avec la thaïlandaise. Pour la deuxième journée consécutive, des affrontements à l’artillerie lourde ont éclaté entre la Thaïlande et le Cambodge. La communauté internationale s’alarme et plusieurs pays ont proposé leur médiation, pour l'instant sans succès. Le Cambodge, qui fait état de 13 morts et de 35 000 personnes ayant fui leur domicile, a réclamé vendredi 25 juillet un « cessez-le-feu immédiat » et « inconditionnel » avec la thaïlandaise. Pour la deuxième journée consécutive, des affrontements à l’artillerie lourde ont éclaté entre la Thaïlande et le Cambodge. La communauté internationale s’alarme et plusieurs pays ont proposé leur médiation, pour l'instant sans succès. Le Cambodge, qui fait état de 13 morts et de 35 000 personnes ayant fui leur domicile, a réclamé vendredi 25 juillet un « cessez-le-feu immédiat » et « inconditionnel » avec la thaïlandaise. Le Cambodge demande un cessez-le-feu immédiat et « inconditionnel » avec la Tha ?? lande. Les deux voisins se sont engagés dans un bras-de-fer depuis la mort d'un soldat cambodgien en mai. Le Cambodge demande un cessez-le-feu immédiat et « inconditionnel » avec la Tha ?? lande. Les deux voisins se sont engagés dans un bras-de-fer depuis la mort d'un soldat cambodgien en mai. Le Cambodge demande un cessez-le-feu immédiat et « inconditionnel » avec la Tha ?? lande. Les deux voisins se sont engagés dans un bras-de-fer depuis la mort d'un soldat cambodgien en mai. Le Cambodge demande un cessez-le-feu immédiat et « inconditionnel » avec la Tha ?? lande. Les deux voisins se sont engagés dans un bras-de-fer depuis la mort d'un soldat cambodgien en mai. Le Cambodge demande un cessez-le-feu immédiat et « inconditionnel » avec la Tha ?? lande. Les deux voisins se sont engagés dans un bras-de-fer depuis la mort d'un soldat cambodgien en mai.",495,,,0.7456408739089966,0.224042303074429,0.5957540259740262,0.35656565656565653,0.3189340210616806,0.5239672624503244
86,confidence_weighted,"Le gang BlackSuit vient de subir un sérieux revers. Spécialisé dans l’extorsion par ransomware, le groupe criminel a vu ses principaux sites du dark web saisis par les autorités américaines. Le gang BlackSuit vient de subir un sérieux revers. Spécialisé dans l’extorsion par ransomware, le groupe criminel a vu ses principaux sites du dark web saisis par les autorités américaines. Le gang BlackSuit vient de subir un sérieux revers. Spécialisé dans l’extorsion par ransomware, le groupe criminel a vu ses principaux sites du dark web saisis par les autorités américaines. Le gang BlackSuit vient de subir un sérieux revers. Spécialisé dans l’extorsion par ransomware, le groupe criminel a vu ses principaux sites du dark web saisis par les autorités américaines. Le gang BlackSuit vient de subir un sérieux revers. Spécialisé dans l’extorsion par ransomware, le groupe criminel a vu ses principaux sites du dark web saisis par les autorités américaines. BlackSuit, un gang spécialisé dans l'extorsion par ransomware, vient de se retrouver dans le collimateur des autorités américaines. Il a vu ses principaux sites du dark web saisis par les États-Unis. BlackSuit, un gang spécialisé dans l'extorsion par ransomware, vient de se retrouver dans le collimateur des autorités américaines. Il a vu ses principaux sites du dark web saisis par les États-Unis. BlackSuit, un gang spécialisé dans l'extorsion par ransomware, vient de se retrouver dans le collimateur des autorités américaines. Il a vu ses principaux sites du dark web saisis par les États-Unis. BlackSuit, un gang spécialisé dans l'extorsion par ransomware, vient de se retrouver dans le collimateur des autorités américaines. Il a vu ses principaux sites du dark web saisis par les États-Unis. BlackSuit, un gang spécialisé dans l'extorsion par ransomware, vient de se retrouver dans le collimateur des autorités américaines. Il a vu ses principaux sites du dark web saisis par les États-Unis.",305,,,0.9396111369132996,0.20416218279483828,0.5821112295081969,0.3540983606557377,0.22480713596914176,0.5812831403112232
87,confidence_weighted,"XSS, l’un des plus gros forums criminels du dark web, vient de tomber. Saisie par la police française, la plateforme laisse sur le carreau plus de 50 000 pirates. À lire aussi : Vol de données – le malware Lumma fait un retour en force, deux mois après son démantèlement Un pirate interpellé en Ukraine Peu avant la fermeture de la plate-forme, les autorités françaises ont finalement été interpellées. XSS, l’un des plus gros forums criminels du dark web, vient de tomber. Saisie par la police française, la plateforme laisse sur le carreau plus de 50 000 pirates. À lire aussi : Vol de données – le malware Lumma fait un retour en force, deux mois après son démantèlement Un pirate interpellé en Ukraine Peu avant la fermeture de la plate-forme, les autorités françaises ont finalement été interpellées. XSS, l’un des plus gros forums criminels du dark web, vient de tomber. Saisie par la police française, la plateforme laisse sur le carreau plus de 50 000 pirates. À lire aussi : Vol de données – le malware Lumma fait un retour en force, deux mois après son démantèlement Un pirate interpellé en Ukraine Peu avant la fermeture de la plate-forme, les autorités françaises ont finalement été interpellées. XSS, l’un des plus gros forums criminels du dark web, vient de tomber. Saisie par la police française, la plateforme laisse sur le carreau plus de 50 000 pirates. À lire aussi : Vol de données – le malware Lumma fait un retour en force, deux mois après son démantèlement Un pirate interpellé en Ukraine Peu avant la fermeture de la plate-forme, les autorités françaises ont finalement été interpellées. XSS, l’un des plus gros forums criminels du dark web, vient de tomber. Saisie par la police française, la plateforme laisse sur le carreau plus de 50 000 pirates. À lire aussi : Vol de données – le malware Lumma fait un retour en force, deux mois après son démantèlement Un pirate interpellé en Ukraine Peu avant la fermeture de la plate-forme, les autorités françaises ont finalement été interpellées. XSS [.is] vient de fermer ses portes. Le site du dark web affiche désormais un avis de saisie. Cette mesure a été prise par la Brigade de Lutte Contre la Cybercriminalité. XSS [.is] vient de fermer ses portes. Le site du dark web affiche désormais un avis de saisie. Cette mesure a été prise par la Brigade de Lutte Contre la Cybercriminalité. XSS [.is] vient de fermer ses portes. Le site du dark web affiche désormais un avis de saisie. Cette mesure a été prise par la Brigade de Lutte Contre la Cybercriminalité. XSS [.is] vient de fermer ses portes. Le site du dark web affiche désormais un avis de saisie. Cette mesure a été prise par la Brigade de Lutte Contre la Cybercriminalité. XSS [.is] vient de fermer ses portes. Le site du dark web affiche désormais un avis de saisie. Cette mesure a été prise par la Brigade de Lutte Contre la Cybercriminalité.",500,,,0.9565646052360535,0.16222767521025985,0.6531200000000001,0.358,0.6345161290322581,0.5986728142803945
88,confidence_weighted,"Les cyberattaques continuent de pleuvoir suite à la découverte des failles de Microsoft SharePoint. Microsoft a découvert que des pirates chinois se servent des vulnérabilités pour propager un ransomware, le redoutable Warlock. Dans un billet de blog publié ce , Microsoft indique avoir découvert qu’un gang, répertorié sous le nom de code Storm-2603, s’est servi de la vulnérabilité de son système d’exploitation Windows Server 2008 (Windows XP) pour développer une faille de sécurité dans le cœur de Windows, afin de mettre en place un programme malveillant capable de prendre le contrôle de l’ensemble du système. Les cyberattaques continuent de pleuvoir suite à la découverte des failles de Microsoft SharePoint. Microsoft a découvert que des pirates chinois se servent des vulnérabilités pour propager un ransomware, le redoutable Warlock. Dans un billet de blog publié ce , Microsoft indique avoir découvert qu’un gang, répertorié sous le nom de code Storm-2603, s’est servi de la vulnérabilité de son système d’exploitation Windows Server 2008 (Windows XP) pour développer une faille de sécurité dans le cœur de Windows, afin de mettre en place un programme malveillant capable de prendre le contrôle de l’ensemble du système. Les cyberattaques continuent de pleuvoir suite à la découverte des failles de Microsoft SharePoint. Microsoft a découvert que des pirates chinois se servent des vulnérabilités pour propager un ransomware, le redoutable Warlock. Dans un billet de blog publié ce , Microsoft indique avoir découvert qu’un gang, répertorié sous le nom de code Storm-2603, s’est servi de la vulnérabilité de son système d’exploitation Windows Server 2008 (Windows XP) pour développer une faille de sécurité dans le cœur de Windows, afin de mettre en place un programme malveillant capable de prendre le contrôle de l’ensemble du système. Les cyberattaques continuent de pleuvoir suite à la découverte des failles de Microsoft SharePoint. Microsoft a découvert que des pirates chinois se servent des vulnérabilités pour propager un ransomware, le redoutable Warlock. Dans un billet de blog publié ce , Microsoft indique avoir découvert qu’un gang, répertorié sous le nom de code Storm-2603, s’est servi de la vulnérabilité de son système d’exploitation Windows Server 2008 (Windows XP) pour développer une faille de sécurité dans le cœur de Windows, afin de mettre en place un programme malveillant capable de prendre le contrôle de l’ensemble du système. Les cyberattaques continuent de pleuvoir suite à la découverte des failles de Microsoft SharePoint. Microsoft a découvert que des pirates chinois se servent des vulnérabilités pour propager un ransomware, le redoutable Warlock. Dans un billet de blog publié ce , Microsoft indique avoir découvert qu’un gang, répertorié sous le nom de code Storm-2603, s’est servi de la vulnérabilité de son système d’exploitation Windows Server 2008 (Windows XP) pour développer une faille de sécurité dans le cœur de Windows, afin de mettre en place un programme malveillant capable de prendre le contrôle de l’ensemble du système. Microsoft a découvert que des pirates chinois se servent des failles de SharePoint pour propager un ransomware. Bé Warlock, le virus est proposé par le biais d'un abonnement par un groupeuscule criminel du même nom. Microsoft a découvert que des pirates chinois se servent des failles de SharePoint pour propager un ransomware. Bé Warlock, le virus est proposé par le biais d'un abonnement par un groupeuscule criminel du même nom. Microsoft a découvert que des pirates chinois se servent des failles de SharePoint pour propager un ransomware. Bé Warlock, le virus est proposé par le biais d'un abonnement par un groupeuscule criminel du même nom. Microsoft a découvert que des pirates chinois se servent des failles de SharePoint pour propager un ransomware. Bé Warlock, le virus est proposé par le biais d'un abonnement par un groupeuscule criminel du même nom. Microsoft a découvert que des pirates chinois se servent des failles de SharePoint pour propager un ransomware. Bé Warlock, le virus est proposé par le biais d'un abonnement par un groupeuscule criminel du même nom.",650,,,0.901619017124176,0.2812563604661305,0.5353846153846155,0.372051282051282,0.6020790020790021,0.5742747068113881
89,confidence_weighted,"Intel taille dans le vif. Moins de cinq mois ès son arrivée à la tête du groupe, Lip-Bu Tan met en œuvre une cure d’amaigrissement sans précédent : d'ici fin 2025, l’entreprise supprimera plus de 24 000 postes, soit un quart de ses effectifs mondiaux. Lourdement déficitaire, le géant américain cherche à rationaliser ses opérations et à couper dans les projets jugés peu rentables, notamment en Europe. Dégraisser le mammouth, c’est la mission de Lik-Tung, CEO dIntel en poste depuis le mois de mars. Intel taille dans le vif. Moins de cinq mois ès son arrivée à la tête du groupe, Lip-Bu Tan met en œuvre une cure d’amaigrissement sans précédent : d'ici fin 2025, l’entreprise supprimera plus de 24 000 postes, soit un quart de ses effectifs mondiaux. Lourdement déficitaire, le géant américain cherche à rationaliser ses opérations et à couper dans les projets jugés peu rentables, notamment en Europe. Dégraisser le mammouth, c’est la mission de Lik-Tung, CEO dIntel en poste depuis le mois de mars. Intel taille dans le vif. Moins de cinq mois ès son arrivée à la tête du groupe, Lip-Bu Tan met en œuvre une cure d’amaigrissement sans précédent : d'ici fin 2025, l’entreprise supprimera plus de 24 000 postes, soit un quart de ses effectifs mondiaux. Lourdement déficitaire, le géant américain cherche à rationaliser ses opérations et à couper dans les projets jugés peu rentables, notamment en Europe. Dégraisser le mammouth, c’est la mission de Lik-Tung, CEO dIntel en poste depuis le mois de mars. Intel taille dans le vif. Moins de cinq mois ès son arrivée à la tête du groupe, Lip-Bu Tan met en œuvre une cure d’amaigrissement sans précédent : d'ici fin 2025, l’entreprise supprimera plus de 24 000 postes, soit un quart de ses effectifs mondiaux. Lourdement déficitaire, le géant américain cherche à rationaliser ses opérations et à couper dans les projets jugés peu rentables, notamment en Europe. Dégraisser le mammouth, c’est la mission de Lik-Tung, CEO dIntel en poste depuis le mois de mars. Intel taille dans le vif. Moins de cinq mois ès son arrivée à la tête du groupe, Lip-Bu Tan met en œuvre une cure d’amaigrissement sans précédent : d'ici fin 2025, l’entreprise supprimera plus de 24 000 postes, soit un quart de ses effectifs mondiaux. Lourdement déficitaire, le géant américain cherche à rationaliser ses opérations et à couper dans les projets jugés peu rentables, notamment en Europe. Dégraisser le mammouth, c’est la mission de Lik-Tung, CEO dIntel en poste depuis le mois de mars. Intel supprimera plus de 24 000 postes, soit un quart de ses effectifs mondiaux. Le géant américain cherche à rationaliser ses opérations. Il s'efforce d'améliorer l'efficacité et de renforcer la responsabilité. Intel supprimera plus de 24 000 postes, soit un quart de ses effectifs mondiaux. Le géant américain cherche à rationaliser ses opérations. Il s'efforce d'améliorer l'efficacité et de renforcer la responsabilité. Intel supprimera plus de 24 000 postes, soit un quart de ses effectifs mondiaux. Le géant américain cherche à rationaliser ses opérations. Il s'efforce d'améliorer l'efficacité et de renforcer la responsabilité. Intel supprimera plus de 24 000 postes, soit un quart de ses effectifs mondiaux. Le géant américain cherche à rationaliser ses opérations. Il s'efforce d'améliorer l'efficacité et de renforcer la responsabilité. Intel supprimera plus de 24 000 postes, soit un quart de ses effectifs mondiaux. Le géant américain cherche à rationaliser ses opérations. Il s'efforce d'améliorer l'efficacité et de renforcer la responsabilité.",575,,,0.8134463429450989,0.13467804296183722,0.606836397515528,0.3892753623188405,0.7423309178743961,0.5426230614339314
90,confidence_weighted,"C'est un phénomène habituel mais toujours fascinant : les Perséides se déroulent en ce moment, comme chaque année, et ce pendant tout le mois d'août. Il sera possible, les plus belles nuits, de voir jusqu'à 50, voire 100 étoiles filantes chaque heure. C'est un phénomène habituel mais toujours fascinant : les Perséides se déroulent en ce moment, comme chaque année, et ce pendant tout le mois d'août. Il sera possible, les plus belles nuits, de voir jusqu'à 50, voire 100 étoiles filantes chaque heure. C'est un phénomène habituel mais toujours fascinant : les Perséides se déroulent en ce moment, comme chaque année, et ce pendant tout le mois d'août. Il sera possible, les plus belles nuits, de voir jusqu'à 50, voire 100 étoiles filantes chaque heure. C'est un phénomène habituel mais toujours fascinant : les Perséides se déroulent en ce moment, comme chaque année, et ce pendant tout le mois d'août. Il sera possible, les plus belles nuits, de voir jusqu'à 50, voire 100 étoiles filantes chaque heure. C'est un phénomène habituel mais toujours fascinant : les Perséides se déroulent en ce moment, comme chaque année, et ce pendant tout le mois d'août. Il sera possible, les plus belles nuits, de voir jusqu'à 50, voire 100 étoiles filantes chaque heure. Les Perséides se déroulent en ce moment, comme chaque année, et ce pendant tout le mois d'août. Il sera possible, les plus belles nuits, de voir jusqu'à 50 ou 100 étoiles filantes à l'heure. Lorsque c'est nocturne, la meilleure façon de profiter est de scruter le ciel au sommet du ciel. Le télescope ayant pour objectif de zoomer sur une petite fraction, risque au contraire de vous faire rater toute une flopée de fragments de comète. Les Perséides se déroulent en ce moment, comme chaque année, et ce pendant tout le mois d'août. Il sera possible, les plus belles nuits, de voir jusqu'à 50 ou 100 étoiles filantes à l'heure. Lorsque c'est nocturne, la meilleure façon de profiter est de scruter le ciel au sommet du ciel. Le télescope ayant pour objectif de zoomer sur une petite fraction, risque au contraire de vous faire rater toute une flopée de fragments de comète. Les Perséides se déroulent en ce moment, comme chaque année, et ce pendant tout le mois d'août. Il sera possible, les plus belles nuits, de voir jusqu'à 50 ou 100 étoiles filantes à l'heure. Lorsque c'est nocturne, la meilleure façon de profiter est de scruter le ciel au sommet du ciel. Le télescope ayant pour objectif de zoomer sur une petite fraction, risque au contraire de vous faire rater toute une flopée de fragments de comète. Les Perséides se déroulent en ce moment, comme chaque année, et ce pendant tout le mois d'août. Il sera possible, les plus belles nuits, de voir jusqu'à 50 ou 100 étoiles filantes à l'heure. Lorsque c'est nocturne, la meilleure façon de profiter est de scruter le ciel au sommet du ciel. Le télescope ayant pour objectif de zoomer sur une petite fraction, risque au contraire de vous faire rater toute une flopée de fragments de comète. Les Perséides se déroulent en ce moment, comme chaque année, et ce pendant tout le mois d'août. Il sera possible, les plus belles nuits, de voir jusqu'à 50 ou 100 étoiles filantes à l'heure. Lorsque c'est nocturne, la meilleure façon de profiter est de scruter le ciel au sommet du ciel. Le télescope ayant pour objectif de zoomer sur une petite fraction, risque au contraire de vous faire rater toute une flopée de fragments de comète.",590,,,0.9404507279396057,0.18388608205532628,0.651278757062147,0.3152542372881356,0.4354628422425033,0.5857645049099937
