text_id,fusion_strategy,summary,length,rouge1_f,bertscore_f1,factuality,coherence,readability,engagement,info_density,composite_score
137,confidence_weighted,"Le fleuron européen des puces électroniques présente des résultats financiers en berne, pour le deuxième trimestre 2025. L’entreprise qui emploie près de 11 500 personnes en France est touchée par la baisse de la demande des voitures électriques dont elle fournit les semi-conducteurs. Le fleuron européen des puces électroniques présente des résultats financiers en berne, pour le deuxième trimestre 2025. L’entreprise qui emploie près de 11 500 personnes en France est touchée par la baisse de la demande des voitures électriques dont elle fournit les semi-conducteurs. Le fleuron européen des puces électroniques présente des résultats financiers en berne, pour le deuxième trimestre 2025. L’entreprise qui emploie près de 11 500 personnes en France est touchée par la baisse de la demande des voitures électriques dont elle fournit les semi-conducteurs. Le fleuron européen des puces électroniques présente des résultats financiers en berne, pour le deuxième trimestre 2025. L’entreprise qui emploie près de 11 500 personnes en France est touchée par la baisse de la demande des voitures électriques dont elle fournit les semi-conducteurs. Le fleuron européen des puces électroniques présente des résultats financiers en berne, pour le deuxième trimestre 2025. L’entreprise qui emploie près de 11 500 personnes en France est touchée par la baisse de la demande des voitures électriques dont elle fournit les semi-conducteurs. STMicroelectronics publie des résultats financiers en berne pour le deuxième trimestre 2025. Le fabricant européen de semi-conducteurs est touché par la baisse de la demande de voitures électriques. Son directeur estime toutefois être à nouveau dans une trajectoire de croissance. STMicroelectronics publie des résultats financiers en berne pour le deuxième trimestre 2025. Le fabricant européen de semi-conducteurs est touché par la baisse de la demande de voitures électriques. Son directeur estime toutefois être à nouveau dans une trajectoire de croissance. STMicroelectronics publie des résultats financiers en berne pour le deuxième trimestre 2025. Le fabricant européen de semi-conducteurs est touché par la baisse de la demande de voitures électriques. Son directeur estime toutefois être à nouveau dans une trajectoire de croissance. STMicroelectronics publie des résultats financiers en berne pour le deuxième trimestre 2025. Le fabricant européen de semi-conducteurs est touché par la baisse de la demande de voitures électriques. Son directeur estime toutefois être à nouveau dans une trajectoire de croissance. STMicroelectronics publie des résultats financiers en berne pour le deuxième trimestre 2025. Le fabricant européen de semi-conducteurs est touché par la baisse de la demande de voitures électriques. Son directeur estime toutefois être à nouveau dans une trajectoire de croissance.",415,,,0.9039753079414368,0.10083795163824541,0.5334939759036146,0.383132530120482,0.4775957763638825,0.5472880544262108
138,confidence_weighted,"David Merron / Google / Getty Images Recevez une sélection de conseils stratégiques et d'astuces concrètes chaque semaine dans votre boîte mail avec notre newsletter Guides pratiques. En savoir plus sur l’utilisation des données personnelles DNS est l'acronyme de Domain Name System (système de noms de domaine). Il s'agit en quelque sorte de la commande resolvectl Comme vous pouvez le voir ci-dessous, le système de DNS fournit des informations sur les adresses IP et les noms des sites web que vous visitez régulièrement. David Merron / Google / Getty Images Recevez une sélection de conseils stratégiques et d'astuces concrètes chaque semaine dans votre boîte mail avec notre newsletter Guides pratiques. En savoir plus sur l’utilisation des données personnelles DNS est l'acronyme de Domain Name System (système de noms de domaine). Il s'agit en quelque sorte de la commande resolvectl Comme vous pouvez le voir ci-dessous, le système de DNS fournit des informations sur les adresses IP et les noms des sites web que vous visitez régulièrement. David Merron / Google / Getty Images Recevez une sélection de conseils stratégiques et d'astuces concrètes chaque semaine dans votre boîte mail avec notre newsletter Guides pratiques. En savoir plus sur l’utilisation des données personnelles DNS est l'acronyme de Domain Name System (système de noms de domaine). Il s'agit en quelque sorte de la commande resolvectl Comme vous pouvez le voir ci-dessous, le système de DNS fournit des informations sur les adresses IP et les noms des sites web que vous visitez régulièrement. David Merron / Google / Getty Images Recevez une sélection de conseils stratégiques et d'astuces concrètes chaque semaine dans votre boîte mail avec notre newsletter Guides pratiques. En savoir plus sur l’utilisation des données personnelles DNS est l'acronyme de Domain Name System (système de noms de domaine). Il s'agit en quelque sorte de la commande resolvectl Comme vous pouvez le voir ci-dessous, le système de DNS fournit des informations sur les adresses IP et les noms des sites web que vous visitez régulièrement. David Merron / Google / Getty Images Recevez une sélection de conseils stratégiques et d'astuces concrètes chaque semaine dans votre boîte mail avec notre newsletter Guides pratiques. En savoir plus sur l’utilisation des données personnelles DNS est l'acronyme de Domain Name System (système de noms de domaine). Il s'agit en quelque sorte de la commande resolvectl Comme vous pouvez le voir ci-dessous, le système de DNS fournit des informations sur les adresses IP et les noms des sites web que vous visitez régulièrement. Le système de noms de domaine a un cache DNS local. Il peut être corrompu pour de nombreuses raisons (par exemple, plusieurs adresses IP pour un même domaine, des entrées mal formées ou même un changement d'adresse IP). Si vous avez une connexion internet lente, vous devriez vous souvenir et t, ce qui n'est pas vraiment pratique. Le système de noms de domaine a un cache DNS local. Il peut être corrompu pour de nombreuses raisons (par exemple, plusieurs adresses IP pour un même domaine, des entrées mal formées ou même un changement d'adresse IP). Si vous avez une connexion internet lente, vous devriez vous souvenir et t, ce qui n'est pas vraiment pratique. Le système de noms de domaine a un cache DNS local. Il peut être corrompu pour de nombreuses raisons (par exemple, plusieurs adresses IP pour un même domaine, des entrées mal formées ou même un changement d'adresse IP). Si vous avez une connexion internet lente, vous devriez vous souvenir et t, ce qui n'est pas vraiment pratique. Le système de noms de domaine a un cache DNS local. Il peut être corrompu pour de nombreuses raisons (par exemple, plusieurs adresses IP pour un même domaine, des entrées mal formées ou même un changement d'adresse IP). Si vous avez une connexion internet lente, vous devriez vous souvenir et t, ce qui n'est pas vraiment pratique. Le système de noms de domaine a un cache DNS local. Il peut être corrompu pour de nombreuses raisons (par exemple, plusieurs adresses IP pour un même domaine, des entrées mal formées ou même un changement d'adresse IP). Si vous avez une connexion internet lente, vous devriez vous souvenir et t, ce qui n'est pas vraiment pratique.",700,,,0.8401363492012024,0.22273273324610213,0.5025180952380953,0.20285714285714285,0.5428571428571428,0.4935113814652274
139,confidence_weighted,"Le , la Birmanie était secouée par un violent séisme de magnitudemagnitude 7,7 ayant occasionné d'importants dégâts. Fait rare, voire unique, la rupture de surface le long de la faille de Sagaing a été cée en direct par une caméra de vidéosurveillance. Le , la Birmanie était secouée par un violent séisme de magnitudemagnitude 7,7 ayant occasionné d'importants dégâts. Fait rare, voire unique, la rupture de surface le long de la faille de Sagaing a été cée en direct par une caméra de vidéosurveillance. Le , la Birmanie était secouée par un violent séisme de magnitudemagnitude 7,7 ayant occasionné d'importants dégâts. Fait rare, voire unique, la rupture de surface le long de la faille de Sagaing a été cée en direct par une caméra de vidéosurveillance. Le , la Birmanie était secouée par un violent séisme de magnitudemagnitude 7,7 ayant occasionné d'importants dégâts. Fait rare, voire unique, la rupture de surface le long de la faille de Sagaing a été cée en direct par une caméra de vidéosurveillance. Le , la Birmanie était secouée par un violent séisme de magnitudemagnitude 7,7 ayant occasionné d'importants dégâts. Fait rare, voire unique, la rupture de surface le long de la faille de Sagaing a été cée en direct par une caméra de vidéosurveillance. Le séisme de magnitudemagnitude 7,7 a été capturé en direct par une caméra de vidéosurveillance. La rupture de surface le long de la faille de Sagaing n'est pas rare, voire unique. Le séisme de magnitudemagnitude 7,7 a été capturé en direct par une caméra de vidéosurveillance. La rupture de surface le long de la faille de Sagaing n'est pas rare, voire unique. Le séisme de magnitudemagnitude 7,7 a été capturé en direct par une caméra de vidéosurveillance. La rupture de surface le long de la faille de Sagaing n'est pas rare, voire unique. Le séisme de magnitudemagnitude 7,7 a été capturé en direct par une caméra de vidéosurveillance. La rupture de surface le long de la faille de Sagaing n'est pas rare, voire unique. Le séisme de magnitudemagnitude 7,7 a été capturé en direct par une caméra de vidéosurveillance. La rupture de surface le long de la faille de Sagaing n'est pas rare, voire unique.",365,,,0.8491867184638977,0.0984787664191088,0.5335616438356166,0.5402968036529681,0.636566955549343,0.5679399790966303
140,confidence_weighted,"Le dioxyde de titane est toujours massivement utilisé dans de nombreux produits non alimentaires : cosmétiques, crèmes solaires, dentifrices, médicaments, peintures, p, plastiquesplastiques... Résultat : une contamination omniprésente de l'environnement. Le dioxyde de titane est toujours massivement utilisé dans de nombreux produits non alimentaires : cosmétiques, crèmes solaires, dentifrices, médicaments, peintures, p, plastiquesplastiques... Résultat : une contamination omniprésente de l'environnement. Le dioxyde de titane est toujours massivement utilisé dans de nombreux produits non alimentaires : cosmétiques, crèmes solaires, dentifrices, médicaments, peintures, p, plastiquesplastiques... Résultat : une contamination omniprésente de l'environnement. Le dioxyde de titane est toujours massivement utilisé dans de nombreux produits non alimentaires : cosmétiques, crèmes solaires, dentifrices, médicaments, peintures, p, plastiquesplastiques... Résultat : une contamination omniprésente de l'environnement. Le dioxyde de titane est toujours massivement utilisé dans de nombreux produits non alimentaires : cosmétiques, crèmes solaires, dentifrices, médicaments, peintures, p, plastiquesplastiques... Résultat : une contamination omniprésente de l'environnement. Le dioxyde de titane est interdit comme additif alimentaire depuis 2020 en France et 2022 dans l'Union européenne. Mais les scientifiques ont identifié la présence de nanoparticulesnanoparticles dans des échantillons de lait maternel, animale, infantile. 100 % des laits animaux analysés, qu'ils soient frais ou non, contiennent des particule. Le dioxyde de titane est interdit comme additif alimentaire depuis 2020 en France et 2022 dans l'Union européenne. Mais les scientifiques ont identifié la présence de nanoparticulesnanoparticles dans des échantillons de lait maternel, animale, infantile. 100 % des laits animaux analysés, qu'ils soient frais ou non, contiennent des particule. Le dioxyde de titane est interdit comme additif alimentaire depuis 2020 en France et 2022 dans l'Union européenne. Mais les scientifiques ont identifié la présence de nanoparticulesnanoparticles dans des échantillons de lait maternel, animale, infantile. 100 % des laits animaux analysés, qu'ils soient frais ou non, contiennent des particule. Le dioxyde de titane est interdit comme additif alimentaire depuis 2020 en France et 2022 dans l'Union européenne. Mais les scientifiques ont identifié la présence de nanoparticulesnanoparticles dans des échantillons de lait maternel, animale, infantile. 100 % des laits animaux analysés, qu'ils soient frais ou non, contiennent des particule. Le dioxyde de titane est interdit comme additif alimentaire depuis 2020 en France et 2022 dans l'Union européenne. Mais les scientifiques ont identifié la présence de nanoparticulesnanoparticles dans des échantillons de lait maternel, animale, infantile. 100 % des laits animaux analysés, qu'ils soient frais ou non, contiennent des particule.",395,,,0.8380557894706726,0.34914034696380963,0.5120253164556963,0.410126582278481,0.5521398432790837,0.5680799623344035
141,confidence_weighted,"Et Microsoft a spécifiquement travaillé sur la connectivité, avec un nouveau système d'antennes dynamiques. L'équipé de six antennes, et ajuste la puissance de chacune pour un signal optimal. Le système peut ainsi s'adà la manière dont vous placez et interagissez avec l'ordinateur. Et Microsoft a spécifiquement travaillé sur la connectivité, avec un nouveau système d'antennes dynamiques. L'équipé de six antennes, et ajuste la puissance de chacune pour un signal optimal. Le système peut ainsi s'adà la manière dont vous placez et interagissez avec l'ordinateur. Et Microsoft a spécifiquement travaillé sur la connectivité, avec un nouveau système d'antennes dynamiques. L'équipé de six antennes, et ajuste la puissance de chacune pour un signal optimal. Le système peut ainsi s'adà la manière dont vous placez et interagissez avec l'ordinateur. Et Microsoft a spécifiquement travaillé sur la connectivité, avec un nouveau système d'antennes dynamiques. L'équipé de six antennes, et ajuste la puissance de chacune pour un signal optimal. Le système peut ainsi s'adà la manière dont vous placez et interagissez avec l'ordinateur. Et Microsoft a spécifiquement travaillé sur la connectivité, avec un nouveau système d'antennes dynamiques. L'équipé de six antennes, et ajuste la puissance de chacune pour un signal optimal. Le système peut ainsi s'adà la manière dont vous placez et interagissez avec l'ordinateur. Surface L5G est un ordinateur certifié Copilot+ PC. Il est équipé d'un écran tactile de 13,8 pouces au format 3:2. Microsoft a spécifiquement travaillé sur la connectivité. Surface L5G est un ordinateur certifié Copilot+ PC. Il est équipé d'un écran tactile de 13,8 pouces au format 3:2. Microsoft a spécifiquement travaillé sur la connectivité. Surface L5G est un ordinateur certifié Copilot+ PC. Il est équipé d'un écran tactile de 13,8 pouces au format 3:2. Microsoft a spécifiquement travaillé sur la connectivité. Surface L5G est un ordinateur certifié Copilot+ PC. Il est équipé d'un écran tactile de 13,8 pouces au format 3:2. Microsoft a spécifiquement travaillé sur la connectivité. Surface L5G est un ordinateur certifié Copilot+ PC. Il est équipé d'un écran tactile de 13,8 pouces au format 3:2. Microsoft a spécifiquement travaillé sur la connectivité.",345,,,0.9246266484260559,0.19355005838621478,0.5768115942028986,0.436231884057971,0.38398622470942745,0.5937280954382719
142,confidence_weighted,"Tous ceux qui circulent en voiturevoiture le savent. Les pneus ne sont pas éternels. Ils s'usent un peu plus à chaque kilomètre parcouru. C'est embêtant pour notre portefeuille. Mais, nous n'en avons pas forcément conscience, c'EST sans doute encore plus préoccupant pour l'environnement. Et même pour les ingénieurs ont eu une idée. ils ont ajouté à la formulation de leurs pneus, une substance chimique qui retarde leur dégradation. Fausse bonne idée, semble-t-il. Parce que des chercheurs ont observé, par exemple, que plus de la moitié des saumons qui remontent les cours d'eau de l’État de Washington (États-Unis) meurent avant le frai. Tous ceux qui circulent en voiturevoiture le savent. Les pneus ne sont pas éternels. Ils s'usent un peu plus à chaque kilomètre parcouru. C'est embêtant pour notre portefeuille. Mais, nous n'en avons pas forcément conscience, c'EST sans doute encore plus préoccupant pour l'environnement. Et même pour les ingénieurs ont eu une idée. ils ont ajouté à la formulation de leurs pneus, une substance chimique qui retarde leur dégradation. Fausse bonne idée, semble-t-il. Parce que des chercheurs ont observé, par exemple, que plus de la moitié des saumons qui remontent les cours d'eau de l’État de Washington (États-Unis) meurent avant le frai. Tous ceux qui circulent en voiturevoiture le savent. Les pneus ne sont pas éternels. Ils s'usent un peu plus à chaque kilomètre parcouru. C'est embêtant pour notre portefeuille. Mais, nous n'en avons pas forcément conscience, c'EST sans doute encore plus préoccupant pour l'environnement. Et même pour les ingénieurs ont eu une idée. ils ont ajouté à la formulation de leurs pneus, une substance chimique qui retarde leur dégradation. Fausse bonne idée, semble-t-il. Parce que des chercheurs ont observé, par exemple, que plus de la moitié des saumons qui remontent les cours d'eau de l’État de Washington (États-Unis) meurent avant le frai. Tous ceux qui circulent en voiturevoiture le savent. Les pneus ne sont pas éternels. Ils s'usent un peu plus à chaque kilomètre parcouru. C'est embêtant pour notre portefeuille. Mais, nous n'en avons pas forcément conscience, c'EST sans doute encore plus préoccupant pour l'environnement. Et même pour les ingénieurs ont eu une idée. ils ont ajouté à la formulation de leurs pneus, une substance chimique qui retarde leur dégradation. Fausse bonne idée, semble-t-il. Parce que des chercheurs ont observé, par exemple, que plus de la moitié des saumons qui remontent les cours d'eau de l’État de Washington (États-Unis) meurent avant le frai. Tous ceux qui circulent en voiturevoiture le savent. Les pneus ne sont pas éternels. Ils s'usent un peu plus à chaque kilomètre parcouru. C'est embêtant pour notre portefeuille. Mais, nous n'en avons pas forcément conscience, c'EST sans doute encore plus préoccupant pour l'environnement. Et même pour les ingénieurs ont eu une idée. ils ont ajouté à la formulation de leurs pneus, une substance chimique qui retarde leur dégradation. Fausse bonne idée, semble-t-il. Parce que des chercheurs ont observé, par exemple, que plus de la moitié des saumons qui remontent les cours d'eau de l’État de Washington (États-Unis) meurent avant le frai. Les chercheurs de l'université du Mississippi (États-Unis) ont ajouté une substance chimique qui retarde la dégradation des pneus. Le biochar, c'est un matériau de plus en plus sophistiqué que... des copeaux de bois. Les chercheurs de l'université du Mississippi (États-Unis) ont ajouté une substance chimique qui retarde la dégradation des pneus. Le biochar, c'est un matériau de plus en plus sophistiqué que... des copeaux de bois. Les chercheurs de l'université du Mississippi (États-Unis) ont ajouté une substance chimique qui retarde la dégradation des pneus. Le biochar, c'est un matériau de plus en plus sophistiqué que... des copeaux de bois. Les chercheurs de l'université du Mississippi (États-Unis) ont ajouté une substance chimique qui retarde la dégradation des pneus. Le biochar, c'est un matériau de plus en plus sophistiqué que... des copeaux de bois. Les chercheurs de l'université du Mississippi (États-Unis) ont ajouté une substance chimique qui retarde la dégradation des pneus. Le biochar, c'est un matériau de plus en plus sophistiqué que... des copeaux de bois.",670,,,0.9694100022315979,0.11892524578816803,0.5727838805970149,0.20149253731343283,0.6153808877689475,0.5365266461861726
143,confidence_weighted,"Un avion de recherche scientifique opéré par Météo-France et le CNRS, se tient prêt à décoller à l'aéroport de Toulouse, au moindre début de feux de forêts. Une initiative complexe, mais nécessaire pour anticiper les effets du réchauffement climatique. C'est une première en France et en Europe. Depuis deux semaines, les scientifiques suivent en temps réel les départs de feu via satellites. Ils décollent en moins de 4 heures. ""L'objectif est non seulement de survoler les feux pour mesurer les propriétés de la chaleur dégagée par ces feux. Mais également de pouvoir s'y préparer, et il faut développer des outils de surveillance. Un avion de recherche scientifique opéré par Météo-France et le CNRS, se tient prêt à décoller à l'aéroport de Toulouse, au moindre début de feux de forêts. Une initiative complexe, mais nécessaire pour anticiper les effets du réchauffement climatique. C'est une première en France et en Europe. Depuis deux semaines, les scientifiques suivent en temps réel les départs de feu via satellites. Ils décollent en moins de 4 heures. ""L'objectif est non seulement de survoler les feux pour mesurer les propriétés de la chaleur dégagée par ces feux. Mais également de pouvoir s'y préparer, et il faut développer des outils de surveillance. Un avion de recherche scientifique opéré par Météo-France et le CNRS, se tient prêt à décoller à l'aéroport de Toulouse, au moindre début de feux de forêts. Une initiative complexe, mais nécessaire pour anticiper les effets du réchauffement climatique. C'est une première en France et en Europe. Depuis deux semaines, les scientifiques suivent en temps réel les départs de feu via satellites. Ils décollent en moins de 4 heures. ""L'objectif est non seulement de survoler les feux pour mesurer les propriétés de la chaleur dégagée par ces feux. Mais également de pouvoir s'y préparer, et il faut développer des outils de surveillance. Un avion de recherche scientifique opéré par Météo-France et le CNRS, se tient prêt à décoller à l'aéroport de Toulouse, au moindre début de feux de forêts. Une initiative complexe, mais nécessaire pour anticiper les effets du réchauffement climatique. C'est une première en France et en Europe. Depuis deux semaines, les scientifiques suivent en temps réel les départs de feu via satellites. Ils décollent en moins de 4 heures. ""L'objectif est non seulement de survoler les feux pour mesurer les propriétés de la chaleur dégagée par ces feux. Mais également de pouvoir s'y préparer, et il faut développer des outils de surveillance. Un avion de recherche scientifique opéré par Météo-France et le CNRS, se tient prêt à décoller à l'aéroport de Toulouse, au moindre début de feux de forêts. Une initiative complexe, mais nécessaire pour anticiper les effets du réchauffement climatique. C'est une première en France et en Europe. Depuis deux semaines, les scientifiques suivent en temps réel les départs de feu via satellites. Ils décollent en moins de 4 heures. ""L'objectif est non seulement de survoler les feux pour mesurer les propriétés de la chaleur dégagée par ces feux. Mais également de pouvoir s'y préparer, et il faut développer des outils de surveillance. Les feux de forêts sont scrutés par un avion de recherche scientifique opéré par Météo-France et le CNRS. Une équipe de chercheurs qui récoltent des données pour mieux comprendre les incendies amenés à se multiplier. Les scientifiques suivent en temps réel les départs de feu via satellite. Les feux de forêts sont scrutés par un avion de recherche scientifique opéré par Météo-France et le CNRS. Une équipe de chercheurs qui récoltent des données pour mieux comprendre les incendies amenés à se multiplier. Les scientifiques suivent en temps réel les départs de feu via satellite. Les feux de forêts sont scrutés par un avion de recherche scientifique opéré par Météo-France et le CNRS. Une équipe de chercheurs qui récoltent des données pour mieux comprendre les incendies amenés à se multiplier. Les scientifiques suivent en temps réel les départs de feu via satellite. Les feux de forêts sont scrutés par un avion de recherche scientifique opéré par Météo-France et le CNRS. Une équipe de chercheurs qui récoltent des données pour mieux comprendre les incendies amenés à se multiplier. Les scientifiques suivent en temps réel les départs de feu via satellite. Les feux de forêts sont scrutés par un avion de recherche scientifique opéré par Météo-France et le CNRS. Une équipe de chercheurs qui récoltent des données pour mieux comprendre les incendies amenés à se multiplier. Les scientifiques suivent en temps réel les départs de feu via satellite.",745,,,0.9187763333320618,0.17345253236547414,0.5756241208053693,0.41655480984340043,0.6170715568579261,0.583212265833792
